type,gender,last_type,material,brand,sole_material,lining_material,season,made_in,insole_material,Name,Rating,Code,CMR Price,Event Price,Full Price,discipline,interior_material
Tenis moda,Mujer,Normal,Sintético,Diadora,Caucho,Textil,Toda temporada,China,Textil,Tenis Diadora para Mujer Moda Court7,4.5 , 883016862,,,149.990,Lifestyle,
Tenis moda,Mujer,Normal,Sintético,Adidas Originals,Caucho,Textil,Toda temporada,China,Textil,Tenis Adidas Originals para Mujer Lifestyle Stan Smith,5 , 72777218,,,599.950,,
Tenis deportivos,Hombre,Normal,Sintético,On Running,Caucho,Textil,Toda temporada,Vietnam,,Tenis On Running Hombre Running Cloudflow,4.5 , 48610378,,,799.990,Running,
Tenis,Hombre,Normal,Sintético,Under Armour,Goma,Textil,Toda temporada,Vietnam,Textil,Tenis Under Armour para Hombre Running Charged Bandit Trail 2 | Zapatillas Under Armour Charged Bandit Trail 2,4.9 , 72763363,,,489.990,Running,
Tenis deportivos,Mujer,Normal,Sintético,On Running,Caucho,Textil,Toda temporada,Vietnam,,Tenis deportivo On Running Running Mujer Cloudflyer 4,5 , 48607767,,,999.990,Running,
Tenis moda,Mujer,Normal,Sintético,Adidas Originals,Caucho,Textil,Toda temporada,Indonesia,Textil,Tenis Adidas Originals para Mujer Moda Gazelle | Tenis Adidas Galleze Rosados con Plataforma,4.8 , 72762154,,,649.950,,
Tenis,Hombre,Normal,Sintético,On Running,Caucho,,Toda temporada,Vietnam,Poliéster,Tenis On Running para Hombre Running Cloud X,, 72736673,,,899.990,Running,Poliéster
Tenis moda,Mujer,Normal,Sintético,New Balance,Caucho,Textil,Toda temporada,Vietnam,Textil,Tenis New Balance para Mujer Moda 574,4.7 , 72735875,,,557.990,,
Tenis moda,Mujer,Normal,Tela,On Running,Caucho,Poliéster,Toda temporada,Vietnam,Poliéster,Tenis On Running para Mujer Cross training Cloudrift,5 , 72736645,,,899.990,,
Tenis moda,Unisex,Normal,Tela,Reebok,Goma,Poliéster,Toda temporada,China,Poliéster,Tenis Reebok Club C 85 Harry Potter Unisex | Tenis Harry Potter Reebok Hogwarts,, 72870162,,,259.990,,
Tenis,Hombre,Normal,Sintético,Asics,Caucho,Poliéster,Toda temporada,Vietnam,Poliéster,Tenis Asics para Hombre Running Noosa Tri 15,4.9 , 72878369,,,669.990,Running,
Tenis moda,Mujer,Normal,Tela,Converse,Caucho,Algodón,Toda temporada,Vietnam,,Tenis Converse Mujer Moda Chuck Taylor All Star Lift High,4.8 , 16813221,,,399.990,,
Tenis,Hombre,Normal,Sintético,Fratta,Goma,Poliéster,Toda temporada,China,Poliéster,Tenis Fratta para Hombre Running Soma,5 , 882877811,,,129.990,Running,
Zapatos casuales,Bebé,Normal,Textil,,Pvc,Textil,,,,Tenis Wiger Azul Osc para Niño Los Gomosos,, 126210420,,,64.900,,
Tenis deportivos,Mujer,Normal,Sintético,On Running,Caucho,Textil,Toda temporada,Vietnam,,Tenis deportivo On Running Running Mujer Cloudflyer 4,5 , 48607766,,,999.990,Running,
Tenis moda,Mujer,Normal,Tela,On Running,Caucho,Poliéster,Toda temporada,Vietnam,Poliéster,Tenis On Running para Mujer Cross training Cloud 5 Terry,5 , 72736847,,,949.990,,
Tenis deportivos,Mujer,Normal,Sintético,On Running,Caucho,Poliéster,Toda temporada,Vietnam,Textil,Tenis On Running para Mujer Running Cloud X 3 AD | Zapatillas On Running para Mujer,5 , 72736575,,,899.990,Running,
,Mujer,,Textil,,Goma,Sintético,,,,TENIS UNDER ARMOUR MUJER CHARGED PURSUIT 3 3024889-004,, 128081434,271.832,298.717,359.900,Training,
Tenis,Mujer,Normal,Sintético,Reebok,Goma,Sintético,Toda temporada,Vietnam,Sintético,Tenis Reebok para Mujer Cross training Nanoflex Adventure Tr 2,5 , 72771101,,,389.990,Cross training,
Zapatos casuales,Niño,Normal,Sintético,,Sintético (PU),Textil,,,,Tenis con luces Woder Negro para Niño Los Gomosos,, 126210911,,,109.900,,
Tenis deportivos,Mujer,Normal,Tela,New Balance,Caucho,,Toda temporada,Vietnam,,Tenis New Balance Mujer Running M1,4.5 , 62387928,,,525.990,Running,
,Niño,Normal,Textil,,Caucho,Sintético,,,,Adidas Predator Club Fxg J Guayos negro de niño para futbol,, 128973198,,,279.950,Fútbol,
,Hombre,Normal,Textil,,Caucho,Malla (nylon),,,,Asics Novablast 4 Tenis azul de hombre para correr,, 129240420,,,699.950,Running,
,Mujer,Normal,Textil,,Caucho,Malla (nylon),,,,Nike W Nike Court Vision Lo Nn Tenis blanco de mujer lifestyle,, 126871903,,,399.950,,
Tenis moda,Hombre,Normal,Tela,On Running,Caucho,Poliéster,Toda temporada,Vietnam,Poliéster,Tenis On Running para Hombre Cross training Cloud 5,, 72736530,,,799.990,,
Tenis deportivos,Mujer,Normal,Sintético,Skechers,Goma,Poliéster,Toda temporada,China,,Tenis Skechers Mujer - Zapatos Skechers Dama. Tenis blancos cómodos Skechers para mujer. Zapatillas moda Cross training Go Run consistent Energize,4.2 , 62967076,,,299.990,Cross training,
Tenis moda,Niño,Normal,Tela,Adidas,Caucho,Textil,Toda temporada,Indonesia,Textil,Tenis Adidas Breaknet para Niño Velcro,, 72808485,173.99,202.99,289.950,,
Tenis deportivos,Hombre,Normal,Tela,Hoka,Caucho,Malla (nylon),Otoño-Invierno,Vietnam,Textil,Tenis Hoka para Hombre Running Clifton 9,, 72863197,,,799.990,Running,
Tenis deportivos,Niño,Normal,Sintético,Diadora,Sintético,,Toda temporada,China,Textil,Tenis Diadora Sporty6 para Niño,4.7 , 882888204,,,129.990,,Poliéster
Tenis moda,Mujer,Normal,Sintético,Skechers,Goma,,Toda temporada,China,Poliéster,Tenis Skechers para Mujer Moda Glide Stepswift Quic,5 , 72791621,,,419.990,,Poliéster
,Mujer,,Cuero,,Goma,Textil,,,,Tenis Converse Botas Cuero Ctas Lift Para Mujer-Blanco,5 , 117186088,,,424.990,,
Tenis moda,Hombre,Normal,Sintético,Skechers,Caucho,Poliéster,Toda temporada,Vietnam,Poliéster,Tenis Skechers para Hombre Moda Maxprotectspt Balmer,5 , 72812810,,,399.990,,
,Mujer,,Sintético,,Goma,,,,,Tenis New Balance 410 V8 Mujer-Negro,, 128359462,,,314.990,Running,
Zapatos casuales,Bebé,Normal,Textil,,Pvc,Textil,,,,Tenis Wiger Azul Osc para Niño Los Gomosos,, 126210420,,,64.900,,
Zapatos casuales,Bebé,Normal,Textil,,Pvc,Textil,,,,Tenis Wiger Café para Niño Los Gomosos,4 , 126210385,,,64.900,,
Tenis,Mujer,Normal,Sintético,Asics,Caucho,Poliéster,Toda temporada,Indonesia,Poliéster,Tenis Asics para Mujer Running Gel Cumulus 25,, 72833550,,,699.990,Running,
Tenis moda,Mujer,Grande,Tela,Converse,Caucho,Textil,Toda temporada,Vietnam,,Tenis moda Converse Ctas Move Mujer,5 , 58145163,,,389.990,,
Tenis con luces,Niña,Normal,Sintético,Skechers,Goma,,Toda temporada,China,Poliéster,Tenis con luces Skechers Flutter Heart Lights para Niña Velcro,4.4 , 71200129,160.89,183.89,229.900,,Poliéster
Tenis moda,Hombre,Normal,Cuero,Nike,Caucho,Poliéster,Toda temporada,China,Poliéster,Tenis Nike para Hombre Moda Dunk Low Retro Bttys | Zapatillas Nike para Hombre Dunk,, 72826068,,,649.950,,
Tenis moda,Hombre,Normal,Sintético,Skechers,Sintético,Poliéster,Toda temporada,Vietnam,Poliéster,Tenis Skechers para Hombre Moda Skechaircourt Homegr,5 , 72823043,,,319.990,,
Tenis deportivos,Hombre,Normal,Sintético,Fratta,Sintético,Sintético,Toda temporada,China,,Tenis Fratta Hombre Running Rollinarew,4.4 , 882816217,,,149.990,Running,
Tenis deportivos,Mujer,Normal,Tela,Hoka,Caucho,Textil,Otoño-Invierno,Vietnam,Textil,Tenis Hoka para Mujer Running Challenger ATR 7,, 72863201,,,749.990,Running,
,Mujer,Normal,Textil,,Caucho,Malla (nylon),,,,Nike W Nike Court Vision Lo Be Tenis blanco de mujer lifestyle,, 127869625,,,399.950,,
Tenis moda,Hombre,Normal,Sintético,Diadora,Goma,Textil,Toda temporada,China,Textil,Tenis Diadora para Hombre Moda Court7 Cl,5 , 883015925,,,159.990,Lifestyle,
Tenis moda,Mujer,Normal,Sintético,On Running,Caucho,,Toda temporada,Vietnam,Sintético,Tenis On Running Mujer Moda THE ROGER Advantage,, 70110749,,,799.990,,Sintético
Tenis deportivos,Hombre,Normal,Sintético,On Running,Caucho,Textil,Toda temporada,Vietnam,,Tenis On Running Hombre Running Cloud X 3,, 48607746,,,899.990,Running,
Tenis con luces,Niña,Normal,Tela,Skechers,Goma,,Toda temporada,China,Poliéster,Tenis con luces Skechers Flutterheartlights B para Niña Velcro,, 72794599,160.89,183.89,229.900,,Poliéster
Tenis moda,Hombre,Normal,Tela,Converse,Caucho,,Toda temporada,Vietnam,Poliéster,Tenis Converse Cta Star Cx Explore | Tenis de moda Converse,, 72763243,367.49,419.99,524.990,,Textil
Tenis deportivos,Mujer,Normal,Sintético,Asics,Caucho,Sintético,Toda temporada,Camboya,Sintético,Tenis Asics Mujer para jugar tenis Gel Game 9,4.9 , 69295370,,,369.990,Tenis,
Tenis,Mujer,Normal,Tela,Adidas,Caucho,Textil,Toda temporada,Indonesia,Textil,Tenis Adidas para Mujer Running Galaxy 6,4.9 , 72781039,,,329.950,Running,
Tenis moda,Hombre,Normal,Cuero,Reebok,Goma,Textil,Toda temporada,Vietnam,Textil,Tenis Reebok para Hombre Moda Ex-O-Fit Hi,, 72815548,,,389.990,,
Tenis deportivos,Mujer,Normal,Sintético,On Running,Caucho,Textil,Toda temporada,Vietnam,,Tenis deportivo On Running Running Mujer Cloudflyer 4,5 , 48607766,,,999.990,Running,
Tenis deportivos,Mujer,Normal,Tela,New Balance,Caucho,Textil,Toda temporada,Vietnam,,Tenis New Balance Mujer Running D1,4.8 , 62387941,,,557.990,Running,
Zapatos casuales,Bebé,Normal,Textil,,Pvc,Textil,,,,Tenis Wiger Café para Niño Los Gomosos,4 , 126210385,,,64.900,,
Zapatos casuales,Bebé,Normal,Textil,,Pvc,Textil,,,,Tenis Wiger Azul Osc para Niño Los Gomosos,, 126210420,,,64.900,,
Tenis deportivos,Hombre,Normal,Sintético,Reebok,Caucho,,Toda temporada,Indonesia,,Tenis Reebok Hombre Running Energen Lite,4.6 , 38214214,,,209.990,Running,Textil
Guayos,Hombre,Normal,Sintético,Puma,Sintético,,Toda temporada,Camboya,Textil,Guayos Puma con taches para Hombre Attacanto Fg/Ag,, 72794423,,,309.900,Fútbol,Textil
Tenis deportivos,Hombre,Normal,Sintético,Asics,Caucho,Poliuretano,Toda temporada,Vietnam,Textil,Tenis Asics Hombre Running Novablast 3,4.8 , 71282678,,,699.990,Running,
Tenis deportivos,Mujer,Normal,Sintético,On Running,Caucho,Textil,Toda temporada,Vietnam,,Tenis deportivo On Running Running Mujer Cloudflyer 4,5 , 48607766,,,999.990,Running,
Tenis deportivos,Mujer,Normal,Tela,New Balance,Caucho,Textil,Toda temporada,Vietnam,,Tenis New Balance Mujer Running D1,4.8 , 62387941,,,557.990,Running,
Tenis moda,Niño,Normal,Sintético,Skechers,Goma,,Toda temporada,China,,Tenis Skechers Bounder Verkona Niño,5 , 62842112,,,179.990,,Poliéster
Tenis,Mujer,Normal,Tela,On Running,Caucho,,Toda temporada,Vietnam,Poliéster,Tenis On Running para Mujer Cross training Cloudnova Flux,, 72736561,,,949.990,Cross training,Poliéster
Tenis deportivos,Hombre,Normal,Tela,Reebok,Goma,Sintético,Toda temporada,Vietnam,Sintético,Tenis Reebok Hombre Running Reebok Lite 3,4.6 , 72713901,,,219.900,Running,
,Hombre,,Textil,,Goma,Textil,,,,Tenis Hombre Nike Waffle One - Gris,5 , 123381628,544.135,597.95,664.950,,
,Mujer,Pequeña,Sintético,,Sintético (PU),Textil,,,,Tenis Puma para Mujer Future Rider Displaced Rosa 38314815,, 128115667,458.64,504.0,594.000,Outdoor,
Zapatos casuales,Hombre,Normal,Sintético,,Sintético (PU),Textil,,,,Tenis Rogger Miel para Hombre Croydon,, 129204491,,,156.900,,
Tenis deportivos,Hombre,Normal,Sintético,Fratta,Sintético,Sintético,Toda temporada,China,,Tenis Fratta Hombre Running Tinmar3,4.7 , 882816209,89.99,104.99,149.990,Running,
Tenis moda,Mujer,Normal,Sintético,ON RUNNING,Caucho,,Toda temporada,Vietnam,Poliéster,Tenis On Running para Mujer Moda Cloud X Shift,5 , 72736631,,,949.990,,Poliéster
Tenis moda,Mujer,Grande,Tela,Converse,Caucho,,Toda temporada,Vietnam,Poliéster,Tenis Converse para Mujer Moda Chuck Taylor All Star Lift,5 , 71195899,,,424.990,,Poliéster
Tenis moda,Mujer,Grande,Tela,Converse,Caucho,,Toda temporada,China,Poliéster,Tenis Converse para Mujer Moda Chuck Taylor All Star Lift,5 , 71195835,,,399.990,,Poliéster
Tenis de fútbol,Niño,Normal,Sintético,Adidas,Caucho,Textil,Toda temporada,Myanmar,Textil,Guayos Adidas para Niño pasto Sintético | Tenis de fútbol Adidas Deportivo Ii Tf J para Niño,4.7 , 72881962,119.99,139.99,199.950,,
Tenis moda,Mujer,Normal,Sintético,Skechers,Caucho,Poliéster,Toda temporada,China,Poliéster,Tenis Skechers para Mujer Dlites Arch Fit-Bett Tenis de Moda Skechers,5 , 72775073,272.99,311.99,389.990,,
Tenis moda,Mujer,Normal,Tela,Converse,Caucho,Poliéster,Toda temporada,Vietnam,Poliéster,Tenis Converse para Mujer Moda Chuck Taylor Allstar,, 72870934,,,429.990,Lifestyle,
Tenis moda,Mujer,Normal,Tela,On Running,Caucho,Poliéster,Toda temporada,Vietnam,Poliéster,Tenis On Running para Mujer Cross training Cloud 5 Terry,5 , 72736848,,,949.990,,
Tenis moda,Niño,Normal,Cuero,Reebok,Goma,Textil,Toda temporada,China,Textil,Tenis Reebok Classic para Niño,, 72793527,139.89,159.89,199.900,,
Tenis moda,Mujer,Normal,Sintético,Skechers,Sintético,,Toda temporada,Vietnam,Poliéster,Tenis Skechers para Mujer Moda Skech Aircourt Slick,, 72791601,251.99,287.99,359.990,,Poliéster
Tenis moda,Mujer,Normal,Sintético,ALDO,Goma,Poliéster,Toda temporada,China,Poliéster,Tenis Aldo Mujer Moda Appier,5 , 71235795,209.99,244.99,349.990,,
Tenis moda,Mujer,Normal,Tela,Asics,Caucho,Textil,Toda temporada,Camboya,Textil,Tenis Asics para Mujer Moda Tiger Runner Ii,5 , 72782925,,,369.990,,
Tenis deportivos,Hombre,Normal,Sintético,Nike,Sintético,,Toda temporada,Vietnam,Poliéster,Guayos Nike para Hombre Vapor 15 Club Fg/Mg,, 72783696,,,359.950,Fútbol,Poliéster
Tenis moda,Mujer,Normal,Sintético,Skechers,Goma,,Toda temporada,China,,Tenis Skechers Mujer - Zapatos Skechers Dama Dynamight. Tenis cómodos Azules Skechers para mujer. Zapatillas moda,4.6 , 20997424,,,249.990,,Poliéster
,Hombre,,,,,,,,,TENIS ADIDAS HOMBRE LIGRA 7 M FZ4658,5 , 124050645,234.199,257.361,329.950,Tenis,
Tenis deportivos,Hombre,Normal,Sintético,Asics,Caucho,Poliuretano,Toda temporada,Vietnam,Textil,Tenis Asics Hombre Running Noosa Tri 15,5 , 71279067,,,669.990,Running,
Tenis moda,Mujer,Normal,Sintético,Skechers,Goma,Poliéster,Toda temporada,Vietnam,Poliéster,Tenis Skechers para Mujer Moda On The Go Flex Asp,4.8 , 72820648,,,249.990,,
Tenis moda,Mujer,Normal,Sintético,Skechers,Goma,Poliéster,Toda temporada,Vietnam,Poliéster,Tenis Skechers Mujer - Zapatos Skechers Dama. Tenis negros cómodos Skechers para mujer. Zapatillas moda D'Luxfitness,4.9 , 70961982,251.89,287.89,359.900,,
Tenis deportivos,Niña,Normal,Tela,Nike,Goma,,Toda temporada,Vietnam,Poliéster,Tenis Nike Tanjun para Niña,3.5 , 72715526,,,211.950,,Poliéster
Tenis moda,Unisex,Normal,Sintético,Diadora,Sintético,Poliéster,Toda temporada,China,Poliéster,Tenis Diadora Crego Unisex para Niños | Tenis Colegiales Diadora Negros,4.3 , 883001793,,,129.990,,
Tenis moda,Mujer,Normal,Sintético,Skechers,Goma,,Toda temporada,Vietnam,Sintético,Tenis Skechers Mujer - Zapatos Skechers Dama. Tenis cómodos Skechers para mujer. Zapatillas moda Ultraflex 3.0,4.5 , 66228460,,,429.990,,Poliéster
Tenis deportivos,Niño,Normal,Sintético,New Balance,Caucho,,Toda temporada,China,Textil,Tenis New Balance 500 para Niño Velcro,5 , 69653026,229.59,262.39,327.990,,Textil
Tenis moda,Niño,Normal,Cuero,Reebok,Goma,Textil,Toda temporada,China,Textil,Tenis Reebok Classic para Niño,5 , 72815441,174.89,199.89,249.900,,
Tenis moda,Niño,Normal,Cuero,Reebok,Goma,Textil,Toda temporada,China,Textil,Tenis Reebok Classic para Niño,, 72793543,139.89,159.89,199.900,,
Tenis moda,Mujer,,Sintético,Skechers,Sintético,,Toda temporada,China,,Tenis Skechers Mujer Moda Summits Cool Classic,5 , 23121285,,,279.900,,Poliéster
Tenis moda,Niño,Normal,Cuero,Reebok,Goma,Textil,Toda temporada,China,Textil,Tenis Reebok Classic para Niño,, 72793527,139.89,159.89,199.900,,
Tenis deportivos,Mujer,Normal,Sintético,Diadora,Goma,,Toda temporada,Vietnam,Sintético,Tenis Diadora para Mujer Running Snipe | Zapatillas para mujer Diadora,4.7 , 882861176,131.99,153.99,219.990,Running,Sintético
Tenis moda,Niño,Normal,Sintético,Skechers,Goma,Poliéster,Toda temporada,China,Poliéster,Tenis moda Skechers Bounder Rozerg para Niño,, 72882966,,,179.990,,
,Mujer,,Textil,,Goma,Sintético,,,,TENIS UNDER ARMOUR MUJER CHARGED AURORA 2+ 3025238-004,, 128081315,264.279,290.417,349.900,Training,
Tenis,Hombre,Normal,Tela,Hoka,Goma,Textil,Toda temporada,Vietnam,Textil,Tenis Hoka para Hombre Running Rincon 3,, 72783064,,,699.990,Running,
Tenis moda,Mujer,Normal,Sintético,Adidas Originals,Caucho,Textil,Toda temporada,Indonesia,Textil,Tenis Adidas Originals para Mujer Moda Superstar,4.8 , 72781095,359.99,419.99,599.950,,
Tenis moda,Hombre,Normal,Sintético,Converse,Caucho,Textil,Toda temporada,Vietnam,Poliéster,Tenis Converse Pro Blaze V2 | Tenis de moda Converse,5 , 72763258,328.99,375.99,469.990,,
,Mujer,Normal,Sintético,,Goma,Sintético,,,,Tenis Puma Blanco Carina Str 389392-01,, 126658485,,,413.000,Lifestyle,
Tenis,Hombre,Normal,Tela,Hoka,Goma,Textil,Toda temporada,Vietnam,Textil,Tenis Hoka para Hombre Running Bondi X,, 72783050,,,1.199.990,Running,
,Mujer,Normal,Sintético,,Goma,Sintético,,,,Guess tennis para mujer blancos Originales,, 127833637,,,419.900,,
Tenis deportivos,Hombre,Normal,Sintético,On Running,Caucho,Poliéster,Toda temporada,Vietnam,Textil,Tenis On Running para Hombre Running Cloudflyer 4 | Zapatillas On Running para Hombre,, 72736879,,,999.990,Running,
Tenis moda,Niño,Normal,Cuero,Nike,Caucho,Poliéster,Toda temporada,Vietnam,Poliéster,Tenis Nike Court Legacy para Niño con cierre de Velcro | Zapatillas Nike para Niño,4 , 72828098,,,294.950,,
,Hombre,Normal,Cuero,,Goma,Textil,,,,Zapatillas Lacoste Chaymon Crafted 07221 - Hombre,, 126764771,,,799.000,,
Tenis moda,Niño,Normal,Cuero,Reebok,Goma,Textil,Toda temporada,China,Textil,Tenis Reebok Classic para Niño,, 72793542,139.89,159.89,199.900,,
Tenis deportivos,Mujer,Normal,Sintético,Mountain Gear,Goma,Poliéster,Toda temporada,China,Poliéster,Tenis Mountain Gear para Mujer Trekking Anitaalt,5 , 883020221,,,239.990,Trekking,
,Hombre,,Textil,,,,,,,Tenis Hombre adidas Lite Racer Adapt 4.0 - Verde-Negro,, 128103571,186.459,204.9,272.900,,
Tenis moda,Mujer,Normal,Cuero,Skechers,Goma,Poliéster,Toda temporada,China,Poliéster,Tenis Skechers para Mujer Moda Sportcourt 92 Illustrious | Tenis de moda Negros Skechers para Mujer con suela blanca,4 , 72826790,,,319.990,,
Tenis moda,Mujer,Normal,Tela,Disney,Caucho,Sintético,Toda temporada,China,Sintético,Tenis Disney para Mujer Moda Bealtdis4,5 , 882994360,,,139.990,Lifestyle,
Tenis moda,Mujer,Normal,Tela,Veja,Caucho,Poliéster,Toda temporada,Brasil,Textil,Tenis Veja para Mujer Moda Volley Tela,, 72884456,,,749.990,Lifestyle,
Tenis moda,Niña,Normal,Sintético,Skechers,Goma,Poliéster,Toda temporada,China,Poliéster,Tenis Moda Skechers Microspecmax Epicbri para Niña Velcro,5 , 72838559,,,189.900,,
,Hombre,,,,,,,,,Tenis negro puma hombre suede classic 462095,, 119588554,,,486.000,,
,Hombre,Normal,Sintético,,,,,,,Zapatilla Torretin Futbol Lotto Estadio Hge H1 Sintetica,, 125968863,,,189.900,Fútbol,
,Mujer,Normal,Sintético,,Sintético (PU),Sintético,,,,Tenis Sneakers Martina,5 , 122869752,,,109.900,,
Tenis moda,Niño,Normal,Sintético,Asics,Caucho,Poliéster,Toda temporada,Camboya,Poliéster,Tenis Asics Gel Resolution 9 para Niño | Zapatillas Asics Gel Resolution 9 para Niño,5 , 72835912,,,369.990,,
Tenis moda,Niño,Normal,Cuero,Reebok,Goma,Textil,Toda temporada,China,Textil,Tenis Reebok Classic para Niño,, 72793527,139.89,159.89,199.900,,
,Hombre,,Textil,,,,,,,Tenis Hombre Adidas Lite Racer CLN 2.0 - Negro,, 118465483,255.619,280.9,375.900,Running,
,Mujer,,Textil,,Goma,,,,,Tenis New Balance Fresh Foam Arishi V4 Mujer-Negro,5 , 126746275,318.491,349.99,459.990,Running,
Tenis moda,Hombre,Normal,Sintético,Puma,Caucho,,Toda temporada,Vietnam,Textil,Tenis Puma para Hombre Moda Bmw Mms Rs-X,, 72794452,,,649.990,,Textil
Tenis moda,Niño,Normal,Sintético,Skechers,Goma,Poliéster,Toda temporada,China,Poliéster,Tenis moda Skechers Bounder Rozerg para Niño,, 72882966,,,179.990,,
,Mujer,,Textil,,,,,,,Tenis Mujer adidas Puremotion Adapt - Negro-Blanco,, 128283003,217.399,238.9,318.900,Running,
Tenis,Hombre,Normal,Tela,Under Armour,Goma,Textil,Toda temporada,Vietnam,Textil,Tenis Under Armour para Hombre Running Charged Escape4,, 72824011,,,409.990,Running,
Tenis moda,Mujer,Normal,Sintético,Skechers,Caucho,Poliéster,Toda temporada,Vietnam,Poliéster,Tenis Skechers para MujerSlip Ins Go Walk 6-Lovely Day Tenis de Moda Skechers,5 , 72775035,272.89,311.89,389.900,,
,Hombre,Normal,Textil,,Caucho,Sintético,,,,Nike Legend 10 Academy Tf Guayos verde de hombre para futbol,, 128052055,,,464.950,Fútbol,
Tenis deportivos,Hombre,Normal,Cuero,Under Armour,Goma,Textil,Toda temporada,Vietnam,Textil,Tenis Under Armour para Hombre Running Surge 3,, 72890685,,,309.990,Running,
,Mujer,Normal,Textil,,Caucho,Malla (nylon),,,,Asics Gel-Contend 8 Tenis negro de mujer para correr,, 126714410,,,349.950,Running,
Tenis moda,Mujer,Normal,Tela,Adidas,Caucho,Textil,Toda temporada,Vietnam,Textil,Tenis Adidas para Mujer Moda Bravada 2.0 Platform,, 72888968,251.99,293.99,419.990,Lifestyle,
Tenis moda,Hombre,Normal,Sintético,Puma,Caucho,,Toda temporada,China,Textil,Tenis Puma para Hombre Moda Graviton Pro,5 , 72794158,,,459.900,,Textil
,Mujer,Normal,Textil,,Caucho,Textil,,,,Tenis Mujer Adidas Court Silk - Blanco,5 , 119441174,278.369,305.9,409.900,,
Tenis moda,Hombre,Normal,Cuero,Adidas,Caucho,Textil,Toda temporada,Vietnam,Textil,Tenis Adidas para Hombre Moda VL Court 3.0,4.8 , 72888879,,,329.990,Lifestyle,
Tenis moda,Niña,Normal,Sintético,Skechers,Goma,Poliéster,Toda temporada,China,Poliéster,Tenis Moda Skechers Unolite Spreadthelov para Niña | Tenis Skechers para niña diseño Corazones,, 72838642,,,249.900,,
,Hombre,Normal,Textil,,Caucho,Sintético,,,,Adidas Predator Club Sock Tf Guayos negro de hombre para futbol,, 128881234,,,399.950,Fútbol,
Tenis moda,Niño,Normal,Cuero,Reebok,Goma,Textil,Toda temporada,China,Textil,Tenis Reebok Classic para Niño,, 72793541,139.89,159.89,199.900,,
Tenis moda,Niño,Normal,Sintético,Asics,Caucho,Poliéster,Toda temporada,Camboya,Poliéster,Tenis Asics Gel Resolution 9 para Niño | Zapatillas Asics Gel Resolution 9 para Niño,5 , 72835911,,,369.990,,
Tenis moda,Mujer,Normal,Sintético,Steven Madden,Sintético,,Toda temporada,China,Textil,Tenis Steven Madden para Mujer Moda Possession-R2 | Tenis de Moda para Mujer Color Blanco,, 72800073,,,529.000,,Textil
Tenis moda,Mujer,Normal,Sintético,Skechers,Goma,Poliéster,Toda temporada,China,Poliéster,Tenis Skechers para Mujer Moda Skech Air Extreme 2.,5 , 72778437,272.89,311.89,389.900,,
,Mujer,Pequeña,Sintético,,Sintético (PU),Sintético,,,,Tenis Casuales Blanco-Negro Licenses Disney Lewis L Mujer,, 126840447,,,139.900,,
Tenis,Mujer,Normal,Sintético,Asics,Caucho,Poliéster,Toda temporada,Camboya,Poliéster,Tenis Asics para Mujer Running Gel Contend 8,4.8 , 71281984,,,349.990,Running,
Tenis,Mujer,Normal,Tela,Adidas,Caucho,Textil,Toda temporada,Vietnam,Textil,Tenis Adidas para Mujer Training Everyset Trainer,, 72738103,329.99,384.99,549.990,Running,
Tenis moda,Hombre,Normal,Cuero,Adidas Originals,Goma,Textil,Toda temporada,Indonesia,,Tenis adidas Originals Hombre Moda Superstar,4.8 , 4321058,359.99,419.99,599.950,,
Tenis deportivos,Hombre,Normal,Sintético,Asics,Caucho,Poliéster,Toda temporada,Brasil,Poliéster,Tenis Asics Hombre Running Gel-Pulse 14,4.8 , 72713733,,,419.990,Running,
,Mujer,,Textil,,Caucho,Textil,,,,Tenis Mujer Adidas Advantage Base - Blanco-Marrón,, 127196963,272.909,299.9,332.900,,
Tenis deportivos,Hombre,Normal,Tela,On Running,Caucho,Textil,Toda temporada,Vietnam,Textil,Tenis Onrunning para Hombre Running Cloud X 3,, 72901686,,,899.990,Running,
Tenis moda,Hombre,Normal,Sintético,Bearcliff,Caucho,Malla (nylon),Toda temporada,China,Malla (Nylon),Tenis Bearcliff para Hombre Moda Acreta,3 , 883028586,,,139.990,Lifestyle,
,Hombre,,,,,,,,,ZAPATILLA ADIDAS HOMBRE NEGRO COURTBLOCK - IF6449,, 128784789,323.919,355.955,399.950,Running,
Tenis moda,Unisex,Normal,Tela,Adidas,Caucho,Textil,Toda temporada,Camboya,Textil,Tenis Adidas Tensaur Infantil Unisex,, 72833355,195.99,223.99,279.950,,
Guayos,Unisex,Normal,Sintético,Diadora,Goma,Poliéster,Toda temporada,China,Poliéster,Guayos Diadora para Cancha Sintética Futsof Unisex,5 , 883001867,,,149.990,,
Tenis moda,Niño,Normal,Sintético,Skechers,Goma,,Toda temporada,China,Poliéster,Tenis Skechers Illumi Brights Therm para Niño Velcro,5 , 72794530,,,169.900,,Poliéster
Tenis moda,Niño,Normal,Cuero,Reebok,Goma,Textil,Toda temporada,China,Textil,Tenis Reebok Classic para Niño,, 72793527,139.89,159.89,199.900,,
,Bebé,Normal,Textil,,Pvc,Algodón,,,,Zapatilla para bebe niña kasla,5 , 122476363,,,41.400,,
,Hombre,,Sintético,,Goma,,,,,Tenis Jordan Max Aura 5 Brand-Negro,, 123160340,,,799.990,Outdoor,
Tenis,Hombre,Normal,Tela,Adidas,Caucho,Textil,Toda temporada,Myanmar,Textil,Tenis Adidas para Hombre Moda Tenis Courtbeat Court Lifestyle,4.7 , 72094148,,,329.950,Lifestyle,
Tenis moda,Niño,Normal,Sintético,Skechers,Goma,Poliéster,Toda temporada,China,Poliéster,Tenis moda Skechers Bounder Rozerg para Niño,, 72882966,,,179.990,,
,Hombre,,,,,,,,,TENIS ADIDAS HOMBRE TERREX EASTRAIL 2.0 HP8606,4.6 , 121326019,319.339,350.922,449.900,Outdoor,
Tenis moda,Niña,Normal,Sintético,Diadora,Caucho,Poliéster,Toda temporada,China,Poliéster,Tenis Moda Diadora Bampu para Niña,, 883001834,,,129.990,,
Tenis moda,Mujer,Normal,Cuero,Puma,Caucho,Sintético,Toda temporada,Vietnam,Textil,Tenis Puma Mujer Moda Mayze LTH,4.9 , 68696600,,,619.900,,
Tenis con luces,Niña,Normal,Sintético,Skechers,Sintético,,Toda temporada,Vietnam,,Tenis Skechers con Luces Sweetheart Lights para Niña con Velcro,4.7 , 26684565,,,244.900,,Poliéster
Tenis,Hombre,Normal,Tela,Hoka,Goma,Textil,Toda temporada,Vietnam,Textil,Tenis Hoka para Hombre Running Rincon 3,, 72783076,,,699.990,Running,
Tenis moda,Niño,Normal,Sintético,Diadora,Sintético,,Toda temporada,China,Sintético,Tenis Diadora Boy Crego 7 para Niño,4.9 , 882817636,,,139.990,,Sintético
Tenis,Hombre,Normal,Tela,Reebok,Goma,Textil,Toda temporada,China,Textil,Tenis Reebok para Hombre Running Energen Lux | Tenis para Hombre de Running Color Gris,5 , 72816066,,,219.900,Running,
