type,gender,last_type,material,brand,sole_material,lining_material,season,made_in,insole_material,Name,Rating,Code,CMR Price,Event Price,Full Price,discipline,interior_material
Tenis moda,Niño,Normal,Sintético,Skechers,Goma,Poliéster,Toda temporada,China,Poliéster,Tenis moda Skechers Bounder Rozerg para Niño,, 72882971,,,179.990,,
Tenis moda,Niña,Normal,Tela,ELV,Goma,,Toda temporada,China,Sintético,Tenis ELV Canlow Blanco para Niña,3.7 , 882812690,65.99,76.99,109.990,,Textil
Tenis moda,Unisex,Grande,Tela,Converse,Caucho,,Toda temporada,Vietnam,,Tenis Converse Unisex Moda Chuck Taylor All Star,4.9 , 19772336,,,324.990,,Textil
Guayos,Hombre,Normal,Sintético,Puma,Caucho,,Toda temporada,Camboya,Textil,Guayos Puma para cancha Sintética Hombre Attacanto Tt,, 72794332,,,309.900,Fútbol,Textil
Tenis moda,Mujer,Normal,Sintético,Puma,Caucho,,Toda temporada,Vietnam,Textil,Tenis Puma para Mujer Moda Mayze Lth Wns,, 72794814,,,619.900,,Textil
Tenis moda,Mujer,Normal,Sintético,Japan S Pf,Caucho,Poliéster,Toda temporada,Camboya,Poliéster,Tenis Asics Japan S Pf para Mujer Moda,4.7 , 72806993,244.99,279.99,349.990,,
Tenis moda,Hombre,Normal,Sintético,Adidas,Caucho,Textil,Toda temporada,Birmania,Textil,Tenis Adidas para Hombre Moda Park Street,5 , 72781188,,,419.950,,
Tenis moda,Niña,Normal,Sintético,Skechers,Goma,Poliéster,Toda temporada,China,Poliéster,Tenis Moda Skechers Unogen1 Marblesweeth para Niña,5 , 72838510,167.89,191.89,239.900,,
Tenis moda,Mujer,Normal,Sintético,New Balance,Caucho,Textil,Toda temporada,Vietnam,Textil,Tenis New Balance para Mujer Moda 574,4.7 , 72735875,,,557.990,,
Tenis moda,Niña,Normal,Tela,Reebok,Goma,,Toda temporada,China,Textil,Tenis Reebok Rus Runner para Niña,5 , 63117947,139.99,159.99,199.990,,Textil
Tenis deportivos,Hombre,Normal,Cuero,Under Armour,Goma,Textil,Toda temporada,Vietnam,Textil,Tenis Under Armour para Hombre Running Surge 3,, 72890685,,,309.990,Running,
Tenis,Hombre,Normal,Sintético,Asics,Caucho,Poliéster,Toda temporada,Vietnam,Poliéster,Tenis Asics para Hombre Running Novablast 4,4.8 , 72878383,,,699.990,Running,
Tenis moda,Niña,Normal,Sintético,Coniglio,Caucho,,Toda temporada,China,Poliéster,Tenis Coniglio Embrohig Bl2 para Niña,4.6 , 882837988,71.99,83.99,119.990,,Textil
Tenis moda,Mujer,Normal,Sintético,Skechers,Sintético,,Toda temporada,China,,Tenis Moda Skechers Summits Mujer,4.9 , 51528279,179.99,199.99,279.900,,Poliéster
Tenis moda,Mujer,Normal,Sintético,adidas,Caucho,Textil,Toda temporada,Vietnam,Sintético,Tenis adidas Mujer Moda Grand Court TD,4.8 , 56004164,,,299.950,Lifestyle,
Tenis deportivos,Hombre,Normal,Sintético,Asics,Caucho,Poliuretano,Toda temporada,Vietnam,Textil,Tenis Asics Hombre Running Jolt 4,4.9 , 71279039,,,299.990,Running,
Tenis moda,Niño,Normal,Sintético,Asics,Caucho,Poliéster,Toda temporada,Brasil,Poliéster,Tenis Asics Fantasy 4 Ps para Niño Velcro,4.3 , 72822484,161.99,188.99,269.990,,
Tenis deportivos,Mujer,Normal,Cuero,Adidas,Caucho,,Toda temporada,Vietnam,Sintético,Tenis Adidas Mujer para jugar tenis Breaknet 2.0,4.9 , 69678744,,,349.950,Tenis,Sintético
Tenis moda,Hombre,Normal,Sintético,New Balance,Caucho,Textil,Toda temporada,Indonesia,Textil,Tenis New Balance 500 para Hombre,5 , 69639251,,,400.990,,
Tenis moda,Hombre,Normal,Cuero,Puma,Caucho,Sintético,Toda temporada,Vietnam,Textil,Tenis Puma para Hombre Moda Palermo Lth,5 , 72878592,,,549.990,Lifestyle,
Tenis moda,Niña,Normal,Sintético,Skechers,Goma,Poliéster,Toda temporada,China,Poliéster,Tenis Moda Skechers Microspecmax Epicbri para Niña Velcro,1 , 72838552,132.89,151.89,189.900,,
Tenis deportivos,Hombre,Normal,Tela,Puma,Caucho,,Toda temporada,China,Textil,Tenis Puma para Hombre Running Transport,, 72794090,,,389.900,Running,Textil
Tenis moda,Hombre,Normal,Cuero,Veja,Goma,Sintético,Toda temporada,Brasil,,Tenis moda Veja Campo Hombre,5 , 62677172,759.99,854.99,949.990,,
Tenis deportivos,Hombre,Normal,Tela,Adidas,Sintético,Textil,Toda temporada,Indonesia,Textil,Tenis Adidas Hombre Running  Switch Move U,4.9 , 71786730,,,299.990,Running,
Guayos,Unisex,Normal,Sintético,Diadora,Caucho,Poliéster,Toda temporada,China,Poliéster,Guayos Diadora Futsokt Unisex,5 , 883001555,99.99,109.99,149.990,,
Tenis moda,Mujer,Normal,Cuero,Veja,Caucho,,Toda temporada,Brasil,,Tenis Moda Veja Esplar Logo Mujer,5 , 39522904,,,999.990,,Textil
Tenis,Hombre,Normal,Tela,Under Armour,Sintético,Textil,Toda temporada,Vietnam,Textil,Tenis Under Armour para Mujer Running Essential | Zapatillas Under Armour Essential,4.9 , 72763348,202.99,231.99,289.990,Running,
Tenis moda,Mujer,Normal,Tela,Converse,Caucho,Algodón,Toda temporada,Vietnam,,Tenis Converse Mujer Moda Chuck Taylor All Star Lift High,4.8 , 16813221,,,399.990,,
Tenis moda,Unisex,Grande,Tela,Converse,Caucho,Textil,Toda temporada,Vietnam,Textil,Tenis Converse Unisex Moda Chuck Taylor All Star Lift Platform,5 , 72727836,297.49,339.99,424.990,,
Tenis deportivos,Hombre,Normal,Tela,Reebok,Goma,Sintético,Toda temporada,Vietnam,Sintético,Tenis Reebok Hombre Running Zig Kinetica 3,4.6 , 63869989,,,549.990,Running,
Tenis,Hombre,Normal,Sintético,Reebok,Caucho,Textil,Toda temporada,Vietnam,Textil,Tenis Reebok para Hombre Lifestyle Npc Ii Syn | Zapatillas Reebok Hombre de moda color Negro,4.7 , 4083022,,,289.900,Lifestyle,
Tenis moda,Hombre,Normal,Sintético,Diadora,Goma,Malla (nylon),Toda temporada,China,Malla (Nylon),Tenis Diadora para Hombre Moda Court Midbas,3.5 , 883015978,,,199.990,Lifestyle,
Tenis moda,Niña,Normal,Sintético,Skechers,Goma,,Toda temporada,China,,Tenis Skechers Microspec Brightretr Niña,5 , 64438429,104.89,119.89,149.900,,Poliéster
Tenis moda,Unisex,Normal,Cuero,Vans,Caucho,Textil,Toda temporada,China,Textil,Tenis Vans Unisex Moda Old Skool,4.7 , 28053902,,,329.900,,
Tenis moda,Niña,Normal,Sintético,Diadora,Sintético,Textil,Toda temporada,China,Textil,Tenis Moda Diadora Girl Courtn para Niña,5 , 883001466,99.99,109.99,129.990,,
Tenis deportivos,Hombre,Normal,Tela,Asics,Caucho,Textil,Toda temporada,Camboya,Poliéster,Tenis Asics para Hombre Running Gel-Contend 8,5 , 71278966,,,349.990,Running,
Tenis moda,Niño,Normal,Sintético,Skechers,Goma,Poliéster,Toda temporada,Vietnam,Poliéster,Tenis Moda Skechers Hyper Blitz Hydro Tr para Niño Velcro,5 , 72838710,132.89,151.89,189.900,,
Tenis deportivos,Mujer,Normal,Sintético,Diadora,Caucho,,Toda temporada,Vietnam,Sintético,Tenis Diadora Mujer Running Snipe,5 , 882741220,,,239.990,Running,Textil
Tenis moda,Niña,Normal,Sintético,Skechers,Goma,Sintético,Toda temporada,China,Poliéster,Tenis Skechers Gorun650 Fierceflash para Niña Velcro,5 , 72761945,111.89,127.89,159.900,,
Tenis,Niño,Normal,Sintético,Reebok,Goma,,Toda temporada,Vietnam,Textil,Tenis Reebok para Niño Lifestyle Club C 85,5 , 72768239,139.89,159.89,199.900,Lifestyle,Textil
Tenis deportivos,Hombre,Normal,Sintético,Fratta,Sintético,Sintético,Toda temporada,China,,Tenis Fratta Hombre Running Rollinarew,4.4 , 882816217,89.99,104.99,149.990,Running,
Tenis moda,Hombre,Normal,Sintético,Nautica,Sintético,Textil,Toda temporada,China,Textil,Tenis Nautica para Hombre Eskdale,4.9 , 72371449,,,299.990,,
Tenis moda,Niño,,Sintético,Skechers,Goma,,Toda temporada,China,Poliéster,Tenis Skechers Comfyflex2.0 Tronox para Niño,5 , 72738266,104.89,119.89,149.900,,Poliéster
Tenis deportivos,Unisex,Normal,Sintético,Adidas,Caucho,Textil,Toda temporada,Vietnam,Textil,Tenis Adidas Breaknet Lifestyle adidas Court Tira Regulable de Cierre por Contacto Doble Unisex,4.8 , 72781212,,,239.950,Lifestyle,
Tenis moda,Niña,Normal,Sintético,Adidas,Sintético,Textil,Toda temporada,Vietnam,Textil,Tenis Adidas Advantage para niña con Velcro,, 72833367,167.99,191.99,239.950,,
Tenis moda,Mujer,Normal,Tela,Skechers,Caucho,Poliéster,Toda temporada,China,Poliéster,Tenis Skechers Mujer - Zapatos Skechers Dama D'Lux Fitness - Newmoxie Negro Tenis cómodos para mujer | Zapatillas moda,5 , 72706884,,,359.900,,
Tenis moda,Hombre,Normal,Tela,Skechers,Goma,Poliéster,Toda temporada,Vietnam,Poliéster,Tenis Skechers para Hombre Moda Go Walk Flex Quota,5 , 72728626,170.99,198.99,284.990,,
Tenis moda,Niña,Normal,Sintético,Skechers,Goma,Poliéster,Toda temporada,China,Poliéster,Tenis Moda Skechers Sportcourt92 para Niña Velcro,5 , 72838590,,,219.900,,
Tenis moda,Hombre,Normal,Sintético,Skechers,Caucho,Poliéster,Toda temporada,China,Poliéster,Tenis Skechers para Hombre Uno2-90S2 Tenis de Moda Skechers,4.7 , 72769682,,,379.990,,
Tenis moda,Hombre,Normal,Cuero,New Balance,Caucho,Textil,Toda temporada,Vietnam,Textil,Tenis New Balance para Hombre Moda 550,, 72802593,,,829.990,,
Tenis moda,Mujer,Normal,Sintético,Reebok,Goma,Poliéster,Toda temporada,Vietnam,Poliéster,Tenis Reebok para Mujer Moda Classic Harry Potter | Tenis Harry Potter Reebok Hogwarts,5 , 72870115,,,429.990,Lifestyle,
Tenis moda,Niña,Normal,Sintético,Diadora,Goma,Poliéster,Toda temporada,China,Poliéster,Tenis Moda Diadora Girl Sesport3 para Niña Velcro,, 883001752,99.99,109.99,149.990,,
Tenis moda,Niña,Normal,Sintético,Skechers,Goma,Poliéster,Toda temporada,China,Poliéster,Tenis moda Skechers Go Run 400 V2 Gusto Racer para Niña con Velcro,, 72890115,,,189.990,,
Tenis moda,Hombre,Normal,Cuero,Nike,Caucho,Poliéster,Toda temporada,Vietnam,Poliéster,Tenis Nike para Hombre Moda Air Force 1 '07 An21| Zapatillas Nike para Hombre Air Force 1,, 72825984,,,739.950,,
Tenis moda,Niño,Normal,Cuero,Reebok,Goma,,Toda temporada,China,Textil,Tenis Reebok Kids Cl Lthr 2V para Niño,1 , 72793439,139.89,159.89,199.900,,Textil
Tenis moda,Mujer,Normal,Tela,Nike,Caucho,Malla (nylon),Toda temporada,Vietnam,Malla (Nylon),Tenis Nike para Mujer Moda Wmns Air Jordan 1 Low Se Te V2 | Tenis Jordan,, 72825883,,,759.950,,
Tenis moda,Hombre,Normal,Sintético,Diadora,Goma,,Toda temporada,China,Textil,Tenis Diadora para Hombre Bamtelo,4.5 , 882886058,,,229.990,,Poliéster
Tenis moda,Mujer,Normal,Sintético,Sybilla,Sintético,Sintético,Toda temporada,China,Sintético,Tenis Sybilla para Mujer Moda Beskatexl,, 883029403,,,119.990,Lifestyle,
Tenis moda,Hombre,Normal,Sintético,Asics,Caucho,,Toda temporada,Brasil,Textil,Tenis Asics para Hombre Moda Japan S,, 72768619,223.99,255.99,319.990,,Textil
Tenis moda,Mujer,Normal,Tela,Asics,Caucho,Textil,Toda temporada,Camboya,Textil,Tenis Asics para Mujer Moda Tiger Runner Ii,5 , 72782925,,,369.990,,
Tenis deportivos,Unisex,Normal,Sintético,Adidas,Caucho,,Toda temporada,Vietnam,Textil,Tenis Adidas para Niño Tensaur con Correa Ajustable de Cierre por Contacto,4.8 , 72751889,167.99,191.99,239.950,,Textil
Guayos,Hombre,Normal,Sintético,Adidas,Caucho,Textil,Toda temporada,Camboya,,Guayos para Sintetica Adidas Goletto,4.8 , 38215256,,,249.990,Fútbol,
Tenis,Hombre,Normal,Sintético,Puma,Caucho,,Toda temporada,China,Textil,Tenis Puma para Hombre Lifestyle Shuffle,5 , 72794042,,,349.900,Lifestyle,Textil
Tenis con luces,Niña,Normal,Sintético,Skechers,Goma,,Toda temporada,Vietnam,Poliéster,Tenis con luces Skechers Sweetheartlights Lov para Niña Velcro,2.5 , 28599548,160.89,183.89,229.900,,Poliéster
Tenis moda,Hombre,Normal,Sintético,Skechers,Caucho,Poliéster,Toda temporada,Vietnam,Poliéster,Tenis Skechers para Hombre Moda Maxprotectspt Balmer,5 , 72812830,,,369.990,,
Tenis,Hombre,Normal,Tela,Under Armour,Sintético,Textil,Toda temporada,Vietnam,Textil,Tenis Under Armour para Hombre Running Essential,4.9 , 72763328,,,289.990,Running,
Tenis deportivos,Mujer,Normal,Tela,Reebok,Goma,Sintético,Toda temporada,Vietnam,Sintético,Tenis Reebok Mujer Cross training Nanoflex Tr 2.0,4.8 , 63866741,,,389.990,Cross training,
Tenis con luces,Niño,,Sintético,Skechers,Caucho,,Toda temporada,China,Poliéster,Tenis Skechers con Luces Illumi Brights Thermo Tracker para Niño con Velcro,4.2 , 72761955,118.89,135.89,169.900,,Poliéster
Tenis moda,Hombre,Normal,Sintético,Diadora,Goma,Textil,Toda temporada,China,Textil,Tenis Diadora para Hombre Moda Court7 Cl,5 , 883015925,,,159.990,Lifestyle,
Tenis moda,Niña,Normal,Sintético,Puma,Caucho,Textil,Toda temporada,Indonesia,Textil,Tenis Puma Mayze Lth para Niña,, 72805192,244.99,279.99,349.990,,
Tenis deportivos,Hombre,Normal,Sintético,Nike,Goma,,Toda temporada,China,Poliéster,Tenis Nike para Hombre Running Air Zoom Pegasus 40 Se,5 , 72784087,,,699.950,Running,Poliéster
Tenis moda,Mujer,Normal,Sintético,Skechers,Sintético,,Toda temporada,China,,Tenis Skechers Mujer Moda Uno - Stand On Air,4.3 , 9487715,,,339.990,,Sintético
Tenis moda,Hombre,Normal,Sintético,Asics,Caucho,Textil,Toda temporada,Brasil,Textil,Tenis Asics para Hombre Moda Japan S,5 , 72768626,223.99,255.99,319.990,,
Tenis moda,Niño,Normal,Tela,Skechers,Goma,,Toda temporada,China,Poliéster,Tenis Skechers Comfyflex2.0 Tronox para Niño Velcro,4.9 , 72794558,104.89,119.89,149.900,,Poliéster
Tenis moda,Hombre,Normal,Cuero,Reebok,Goma,Textil,Toda temporada,Vietnam,Textil,Tenis Reebok para Hombre Moda Ex-O-Fit Hi,, 72815548,,,389.990,,
Tenis deportivos,Hombre,Normal,Sintético,Reebok,Caucho,Textil,Toda temporada,Vietnam,,Tenis Reebok Hombre Running Leather,4.7 , 25621574,,,369.990,Running,
Tenis moda,Mujer,Grande,Tela,Converse,Caucho,,Toda temporada,Vietnam,Poliéster,Tenis Converse para Mujer Moda Chuck Taylor All Star Lift,5 , 71195899,297.49,339.99,424.990,,Poliéster
Tenis deportivos,Hombre,Normal,Tela,Adidas,Caucho,Textil,Toda temporada,Indonesia,Textil,Tenis Adidas para Hombre Running Tenis Duramo Sl,4.6 , 72094197,,,349.950,Running,
Tenis moda,Niño,Normal,Sintético,Skechers,Goma,,Toda temporada,China,Poliéster,Tenis Skechers Illumi Brights Therm para Niño Velcro,5 , 72794530,118.89,135.89,169.900,,Poliéster
Tenis deportivos,Niña,Normal,Tela,Nike,Goma,,Toda temporada,Vietnam,Poliéster,Tenis Nike Tanjun para Niña,3.5 , 72715526,148.39,169.59,211.950,,Poliéster
Tenis moda,Mujer,Normal,Cuero,Puma,Caucho,Sintético,Toda temporada,Vietnam,Textil,Tenis Puma para Mujer Moda Suede Xl Wns,, 72878565,,,569.990,Lifestyle,
Tenis,Mujer,Normal,Sintético,Asics,Caucho,Poliéster,Toda temporada,Indonesia,Poliéster,Tenis Asics para Mujer Running Gel Cumulus 25,, 72833550,489.99,559.99,699.990,Running,
Tenis moda,Mujer,Normal,Sintético,Skechers,Goma,Poliéster,Toda temporada,China,Poliéster,Tenis Skechers para Mujer Moda Dynamight2.0 Momento,5 , 72836735,,,249.990,,
Tenis deportivos,Unisex,Normal,Sintético,Adidas,Caucho,,Toda temporada,India,Sintético,Tenis Adidas para Niño Grand Court,4.8 , 72751866,202.99,231.99,289.950,,Sintético
Tenis moda,Mujer,Normal,Sintético,Diadora,Caucho,Malla (nylon),Toda temporada,China,Textil,Tenis Diadora para Mujer Moda Befatex,5 , 883016789,,,189.990,Lifestyle,
Guayos,Niño,,Sintético,adidas,Caucho,,Toda temporada,Camboya,,Guayos adidas Goletto Viii Tf J Niño,4.8 , 62992520,,,199.950,,Textil
Tenis moda,Niña,Normal,Tela,ELV,Goma,,Toda temporada,China,Sintético,Tenis ELV Canlow Pride para Niña,5 , 882812472,65.99,76.99,109.990,,Textil
Tenis moda,Mujer,Normal,Cuero,New Balance,Caucho,Textil,Toda temporada,Indonesia,Textil,Tenis New Balance para Mujer Moda 373,, 72894311,,,329.990,Lifestyle,
Tenis moda,Hombre,Normal,Sintético,Puma,Caucho,Textil,Toda temporada,Vietnam,,Tenis moda Puma Future Rider Play On para Hombre,4.5 , 64280007,391.89,447.89,559.900,,
Tenis moda,Mujer,Grande,Cuero,VEJA,Caucho,,Toda temporada,Brasil,,Tenis Veja Mujer Moda Campo,, 12651166,,,949.990,,Sintético
Tenis moda,Unisex niño,Normal,Sintético,Adidas,Caucho,Textil,Toda temporada,Indonesia,Textil,Tenis Adidas Vl Court 3.0 K Unisex Infantil,, 72882029,,,319.950,,
Tenis,Mujer,Normal,Sintético,Asics,Caucho,Poliéster,Toda temporada,Vietnam,Poliéster,Tenis Asics para Mujer Running Gt 1000 12,, 71282083,384.99,439.99,549.990,Running,
Tenis deportivos,Mujer,Normal,Tela,Reebok,Goma,Sintético,Toda temporada,Vietnam,Sintético,Tenis Reebok Mujer Cross training Flexagon Force 4,5 , 72713944,,,269.900,Cross training,
Tenis moda,Hombre,Normal,Sintético,Newboat,Caucho,Sintético,Toda temporada,China,,Tenis Moda Newboat Gumino Hombre,4.8 , 882430006,83.99,97.99,139.990,,
Tenis moda,Mujer,Normal,Sintético,Call It Spring,Goma,Poliéster,Toda temporada,China,Poliéster,Tenis Call It Spring Mujer Moda Breezey,4.5 , 70706327,125.99,146.99,209.990,,
Tenis deportivos,Hombre,Normal,Sintético,On Running,Caucho,Textil,Toda temporada,Vietnam,Sintético,Tenis On Running Hombre Running Cloud X,5 , 68457141,,,899.990,Running,
Tenis,Hombre,Normal,Sintético,Fratta,Goma,Poliéster,Toda temporada,China,Poliéster,Tenis Fratta para Hombre Running Soma,5 , 882877811,77.99,90.99,129.990,Running,
Tenis,Hombre,Normal,Tela,Adidas,Caucho,Textil,Toda temporada,Indonesia,Textil,Tenis Adidas Running Response Runner | Zapatillas Adidas Running Response Runner,4.8 , 72738207,,,199.990,Running,
Tenis moda,Hombre,Normal,Cuero,Nike,Caucho,Poliéster,Toda temporada,Vietnam,Poliéster,Tenis Nike para Hombre Moda Air Force 1 '07| Zapatillas Nike para Hombre Air Force 1,4 , 72826053,,,739.950,,
Tenis deportivos,Hombre,Normal,Sintético,Asics,Caucho,Poliuretano,Toda temporada,Vietnam,Textil,Tenis Asics Hombre Running Gel-Cumulus 25,5 , 71282378,,,699.990,Running,
Tenis,Unisex,Normal,Sintético,Reebok,Caucho,Textil,Toda temporada,Vietnam,Textil,Tenis Reebok Unisex Lifestyle Reebok Ultra Flash | Zapatillas Reebok Unisex de moda color Silver,, 72832767,,,269.990,Lifestyle,
Tenis,Mujer,Normal,Sintético,Reebok,Goma,Sintético,Toda temporada,Vietnam,Sintético,Tenis Reebok para Mujer Cross training Nanoflex Adventure Tr 2,5 , 72771101,,,389.990,Cross training,
Tenis moda,Mujer,Normal,Tela,Under Armour,Goma,Textil,Toda temporada,Vietnam,Textil,Tenis Under Armour para Mujer Moda Essential,4.5 , 72804532,,,289.990,,
Tenis deportivos,Hombre,Normal,Sintético,Asics,Caucho,Textil,Toda temporada,Camboya,Poliéster,Tenis Asics para Hombre Running Patriot 13,5 , 71278860,,,329.990,Running,
Tenis moda,Unisex,Normal,Sintético,Reebok,Goma,Poliéster,Toda temporada,China,Poliéster,Tenis Reebok Classic Harry Potter Unisex | Tenis Harry Potter Reebok Slytherin,, 72870143,,,299.990,,
Tenis moda,Niño,Normal,Sintético,Skechers,Goma,Poliéster,Toda temporada,China,Poliéster,Tenis moda Skechers Twisty Brights Novl para Niño Velcro,, 72882960,,,219.990,,
Tenis,Hombre,Normal,Sintético,On Running,Caucho,,Toda temporada,Vietnam,Poliéster,Tenis On Running para Hombre Running Cloud X,, 72736673,,,899.990,Running,Poliéster
Tenis deportivos,Hombre,Normal,Sintético,Asics,Caucho,Textil,Toda temporada,Camboya,Poliéster,Tenis Asics para Hombre Running Patriot 13,5 , 71278838,,,329.990,Running,
Tenis deportivos,Mujer,Normal,Sintético,Diadora,Goma,,Toda temporada,Vietnam,Sintético,Tenis Diadora para Mujer Running Snipe | Zapatillas para mujer Diadora,, 882861117,131.99,153.99,219.990,Running,Sintético
Tenis deportivos,Hombre,Normal,Sintético,On Running,Caucho,Textil,Toda temporada,Vietnam,Sintético,Tenis On Running Hombre Running Cloudrunner,, 68457152,,,899.990,Running,
Tenis moda,Hombre,Normal,Cuero,Veja,Goma,Sintético,Toda temporada,Brasil,,Tenis moda Veja Campo Hombre,, 62677220,,,949.990,,
Tenis moda,Mujer,Normal,Sintético,Skechers,Goma,,Toda temporada,China,Poliéster,Tenis Skechers para Mujer Moda Gowalkmassagefit,, 72791506,269.99,314.99,449.990,,Poliéster
Tenis moda,Mujer,Normal,Sintético,Nike,Goma,,Toda temporada,Indonesia,Poliéster,Tenis Nike para Mujer Moda Air Max 90 Nn,5 , 72783803,,,694.950,,Poliéster
Tenis deportivos,Hombre,Normal,Sintético,Asics,Caucho,Poliéster,Toda temporada,Brasil,Poliéster,Tenis Asics Hombre Running Gel-Nagoya 5,4.8 , 72713705,,,449.990,Running,
Tenis deportivos,Hombre,Normal,Sintético,Asics,Caucho,Poliéster,Otoño-Invierno,Vietnam,Poliéster,Tenis Asics para Mujer Running Novablast 4 Tr,, 72902090,,,259.990,Running,
Tenis moda,Niña,Normal,Sintético,Skechers,Goma,,Toda temporada,China,,Tenis Skechers Uno Lite Niña,4.9 , 62842024,,,219.900,,Poliéster
Zapatos casuales,Hombre,Normal,Sintético,Skechers,Goma,Sintético,Toda temporada,China,,Zapatos casuales Skechers Go Walk Max Hombre,5 , 17652641,186.99,197.99,219.990,,
Tenis moda,Unisex,Normal,Tela,Converse,Caucho,Textil,Toda temporada,Vietnam,Textil,Tenis Converse Star Player 76 Unisex Infantil,5 , 72813786,202.99,231.99,289.990,,
Tenis,Mujer,Normal,Tela,Reebok,Goma,Textil,Toda temporada,China,Textil,Tenis Reebok para Mujer Cross Training Flexagon Energy Tr 4 | Tenis para Mujer de Cross Training Color Blanco,5 , 72804681,,,249.990,Cross training,
Guayos,Niño,,Sintético,Puma,Sintético,,Toda temporada,China,,Guayos Puma Rapido III Fg Niño,4.5 , 64398838,,,279.900,,Textil
Tenis,Mujer,Normal,Tela,On Running,Caucho,Poliéster,Toda temporada,Vietnam,Poliéster,Tenis On Running para Mujer Running Cloudflow,5 , 72736906,639.99,719.99,799.990,Running,
Tenis deportivos,Niño,Normal,Sintético,Diadora,Sintético,,Toda temporada,China,Textil,Tenis Diadora Sporty6 para Niño,4.7 , 882888204,99.99,109.99,129.990,,Poliéster
Tenis moda,Hombre,Normal,Sintético,On Running,Caucho,Poliéster,Toda temporada,Vietnam,,Tenis Blancos On Running Hombre The Roger Advantage,, 72717844,639.99,719.99,799.990,,
Tenis,Mujer,Normal,Sintético,Asics,Caucho,Poliéster,Toda temporada,Vietnam,Poliéster,Tenis Asics para Mujer Running Gt 1000 12,, 71282069,384.99,439.99,549.990,Running,
Tenis moda,Mujer,Normal,Cuero,Adidas Originals,Caucho,Textil,Toda temporada,Vietnam,Textil,Tenis Adidas Originals Mujer Moda Gazelle Bold W,5 , 72712261,,,649.950,,
Tenis moda,Mujer,Normal,Sintético,Skechers,Goma,Poliéster,Toda temporada,China,Poliéster,Tenis Skechers para Mujer Moda Summits Free Classics,, 72890310,179.99,199.99,279.900,Lifestyle,
Tenis moda,Hombre,Normal,Sintético,Nike,Goma,Malla (nylon),Toda temporada,India,Malla (Nylon),Tenis Nike para Hombre Moda Court Vision Low,4.5 , 23586108,,,399.990,Lifestyle,
Tenis moda,Hombre,Normal,Cuero,Reebok,Goma,Textil,Toda temporada,Vietnam,Textil,Tenis Reebok para Hombre Moda Bb 4000 II,5 , 72815916,,,439.900,,
Tenis moda,Niña,Normal,Sintético,Puma,Caucho,,Toda temporada,China,Textil,Tenis Puma Rickie Niña,4.8 , 68757580,195.89,223.89,279.900,,Textil
Tenis deportivos,Unisex,Normal,Cuero,Adidas,Caucho,Textil,Toda temporada,China,Textil,Tenis Adidas Forum Low Unisex Infantil,4.9 , 72781251,,,499.950,Lifestyle,
Tenis moda,Hombre,Normal,Sintético,Nike,Caucho,Textil,Toda temporada,Indonesia,Textil,Tenis Nike para Hombre Moda Air Max Sc C/O,4.6 , 60558694,,,664.990,,
Tenis moda,Hombre,Normal,Cuero,Reebok,Goma,Textil,Toda temporada,Vietnam,Textil,Tenis Reebok para Hombre Moda Classic,, 72815744,,,349.900,,
Tenis deportivos,Hombre,Normal,Sintético,Nike,Sintético,,Toda temporada,Vietnam,Poliéster,Guayos Nike para Hombre Vapor 15 Club Fg/Mg,, 72783696,,,359.950,Fútbol,Poliéster
Tenis moda,Hombre,Normal,Tela,On Running,Caucho,Poliéster,Toda temporada,Vietnam,Poliéster,Tenis On Running para Hombre Cross training Cloudnova Form,, 72736479,,,899.990,,
Tenis moda,Unisex bebé,Normal,Sintético,Adidas,Caucho,Textil,Toda temporada,Indonesia,Textil,Tenis Adidas Advantage Cf I Unisex con Velcro,4.7 , 72881989,,,239.950,,
Tenis deportivos,Hombre,Normal,Sintético,Reebok,Goma,,Toda temporada,China,,Tenis Deportivos Reebok para Hombre de Running Energen Tech,5 , 72790743,,,349.990,Running,Textil
Tenis moda,Mujer,Normal,Sintético,Diadora,Caucho,Textil,Toda temporada,China,Textil,Tenis Diadora para Mujer Moda Court7,4.5 , 883016862,,,149.990,Lifestyle,
Tenis moda,Niño,Normal,Sintético,Puma,Caucho,,Toda temporada,Vietnam,Textil,Tenis Puma Wired Run Niño,4.6 , 68757529,181.99,207.99,259.990,,Textil
Tenis moda,Hombre,Normal,Sintético,Skechers,Sintético,Poliéster,Toda temporada,Vietnam,Poliéster,Tenis Skechers para Hombre Moda Skechaircourt Homegr,5 , 72823043,,,319.990,,
Tenis deportivos,Mujer,Normal,Sintético,Mountain Gear,Goma,Poliéster,Toda temporada,China,Poliéster,Tenis Mountain Gear para Mujer Trekking Anitaalt,5 , 883020221,,,239.990,Trekking,
Tenis moda,Niña,Normal,Cuero,Reebok,Goma,,Toda temporada,China,Textil,Tenis Reebok Kids Classic Le para Niña,, 72793507,174.89,199.89,249.900,,Textil
Tenis deportivos,Hombre,Normal,Tela,Reebok,Goma,Sintético,Toda temporada,Vietnam,Sintético,Tenis Reebok Hombre Running Energen Lux,4.8 , 72713866,,,219.900,Running,
Tenis moda,Unisex,Normal,Tela,Converse,Caucho,Poliéster,Toda temporada,Vietnam,Poliéster,Tenis Converse Unisex Moda Chuck Taylor All Star,5 , 72807841,,,399.990,,
Tenis moda,Niña,Normal,Sintético,Skechers,Goma,Poliéster,Toda temporada,China,Poliéster,Tenis moda Skechers Microspec Max Brights para Niña,, 72890108,,,199.990,,
Tenis moda,Niña,Normal,Sintético,Coniglio,Caucho,,Toda temporada,China,Poliéster,Tenis Coniglio Embro Bl1 para Niña,5 , 882837998,71.99,83.99,119.990,,Textil
Tenis deportivos,Hombre,Normal,Tela,Adidas,Caucho,Textil,Toda temporada,Indonesia,Textil,Tenis Adidas Hombre Running Adidas Switch Move,4.8 , 72712365,,,299.990,Running,
Tenis moda,Hombre,Normal,Sintético,Veja,Caucho,,Toda temporada,Brasil,Textil,Tenis Veja para Hombre Moda Urca,5 , 72783255,,,999.990,,Poliéster
Tenis moda,Hombre,Normal,Sintético,Skechers,Goma,Poliéster,Toda temporada,China,Poliéster,Tenis Skechers para Hombre Moda Bounder2.0 Andal,5 , 72823070,,,299.990,,
Tenis moda,Mujer,Normal,Cuero,Puma,Caucho,Sintético,Toda temporada,Vietnam,Textil,Tenis Puma Mujer Moda Mayze LTH,4.9 , 68696600,,,619.900,,
Tenis moda,Mujer,Normal,Sintético,Adidas,Caucho,Textil,Toda temporada,Indonesia,Textil,Tenis Adidas para Mujer Moda Grand Court Base 2,4.3 , 72888808,,,299.990,Lifestyle,
Tenis moda,Hombre,Normal,Cuero,Reebok,Goma,Sintético,Toda temporada,Vietnam,Sintético,Tenis Reebok Hombre Moda Ex-O-Fit Hi,4.8 , 72714142,,,389.990,Lifestyle,
Tenis,Mujer,Normal,Sintético,Asics,Caucho,Poliéster,Toda temporada,Camboya,Poliéster,Tenis Asics para Mujer Running Gel Contend 8,4.8 , 71281984,,,349.990,Running,
