type,gender,last_type,material,brand,sole_material,lining_material,season,made_in,insole_material,Name,Rating,Code,CMR Price,Event Price,Full Price,discipline,interior_material
Tenis moda,Mujer,Normal,Sintético,Skechers,Goma,Poliéster,Toda temporada,China,Poliéster,Tenis Skechers para Mujer Moda Bobs B Flex Hi Levgr,5 , 72820634,209.99,239.99,299.990,,
,Mujer,,Textil,,,,,,,Tenis Mujer Adidas Glaxy 6 Negro- Multicolor,, 128116850,272.909,299.9,332.900,,
Tenis moda,Hombre,Normal,Sintético,Bearcliff,Sintético,Poliéster,Toda temporada,China,Textil,Tenis Bearcliff para Hombre Creton,4.4 , 882882628,,,149.990,,
,Mujer,Pequeña,Sintético,,Goma,Textil,,,,Tenis mujer negros W HOVR TURBULENCE 3025425-001-N11 UNDER ARMOUR,5 , 124609003,,,569.900,Running,
,Mujer,,Sintético,,Goma,,,,,Tenis New Balance 500 Clásicos Mujer-Beige/Café,, 129576652,268.441,294.99,329.990,Outdoor,
Tenis moda,Hombre,Normal,Sintético,Skechers,Goma,Poliéster,Toda temporada,China,Poliéster,Tenis Skechers para Hombre Moda Bounder2.0 Andal,5 , 72823076,,,299.990,,
Tenis moda,Mujer,Normal,Cuero,Skechers,Goma,Poliéster,Toda temporada,China,Poliéster,Tenis Skechers Mujer Moda D'Luxfitness,4.8 , 70962007,,,319.900,,
Tenis deportivos,Hombre,Normal,Tela,Hoka,Goma,Textil,Toda temporada,Vietnam,Textil,Tenis Hoka Hombre Running Clifton 9,4.9 , 67134488,,,799.990,Running,
Tenis moda,Hombre,Normal,Cuero,Diadora,Caucho,Malla (nylon),Toda temporada,China,Malla (Nylon),Tenis Diadora para Hombre Moda Court Xl,, 883076082,,,239.990,Lifestyle,
,Mujer,,Textil,,,,,,,Tenis Mujer adidas Duramo Sl 2.0 - Negro - Blanco,, 128317305,240.149,263.9,353.900,Running,
Tenis moda,Niño,Normal,Sintético,Asics,Caucho,Poliéster,Toda temporada,Camboya,Poliéster,Tenis Asics Gel Resolution 9 para Niño | Zapatillas Asics Gel Resolution 9 para Niño,5 , 72836167,,,369.990,,
Tenis moda,Niño,Normal,Cuero,Reebok,Goma,Textil,Toda temporada,China,Textil,Tenis Reebok Classic para Niño,, 72793527,139.89,159.89,199.900,,
,Mujer,Normal,Sintético,,Caucho,Textil,,,,Tenis Nike Mujer Bajo Court Legacy,, 122994057,,,684.000,Outdoor,
Tenis moda,Niño,Normal,Sintético,Skechers,Goma,Poliéster,Toda temporada,China,Poliéster,Tenis moda Skechers Bounder Rozerg para Niño,, 72882966,,,179.990,,
Tenis moda,Niño,Normal,Sintético,Adidas,Caucho,Textil,Toda temporada,Vietnam,Textil,Tenis moda Adidas Advantage Cf C para Niño,, 72907846,173.99,202.99,289.950,,
Tenis,Hombre,Normal,Sintético,Reebok,Caucho,Textil,Toda temporada,Vietnam,Textil,Tenis Reebok para Hombre Lifestyle Club C 85 | Zapatillas Reebok Hombre de moda color Carbón,, 72832737,,,359.990,Lifestyle,
,Hombre,,Sintético,,Goma,,,,,Zapatillas Nike Legend 10 Club Turf-Blanco,, 125924899,,,324.990,Fútbol,
Tenis moda,Mujer,Normal,Cuero,Asics,Caucho,Poliéster,Toda temporada,Vietnam,Poliéster,Tenis Asics para Mujer Moda Gel-Kayano 14 Suede,, 72833611,,,649.990,,
Tenis moda,Mujer,Normal,Sintético,Skechers,Goma,Poliéster,Toda temporada,China,Poliéster,Tenis Skechers para Mujer Moda Squadair Sweetencoun,, 72836547,,,289.990,,
,Hombre,Normal,Textil,,Goma,Sintético,,,,Tennis ADIDAS mujer morado DURAMO SL IE 7258,, 127598707,,,487.000,Running,
Guayos,Hombre,Normal,Tela,Adidas,Sintético,Textil,Toda temporada,Camboya,Textil,"Guayos Adidas Predator Accuracy.4 Para Multiterreno- Suela Con Taches Tpu. Zapatilla De Fútbol, Color Rojo De Hombre Con Cordones",4.7 , 66596455,,,299.990,Fútbol,
Tenis moda,Hombre,Normal,Cuero,Nike,Goma,Poliéster,Otoño-Invierno,Vietnam,Poliéster,Tenis Nike para Hombre Moda Air Force 1 '07 Ess,, 72897711,,,739.990,Lifestyle,
Tenis moda,Niño,Normal,Cuero,Reebok,Goma,Textil,Toda temporada,China,Textil,Tenis Reebok Classic para Niño,, 72793541,139.89,159.89,199.900,,
,Mujer,Normal,Textil,,Caucho,Textil,,,,Tenis Running Skechers Bobs Sport Squad Turn Up - Azul,, 123359828,,,211.900,,
Tenis moda,Mujer,Normal,Cuero,Diadora,Caucho,Malla (nylon),Toda temporada,China,Malla (Nylon),Tenis Diadora para Mujer Moda W Courtxl,, 883015828,,,239.990,Lifestyle,
Tenis,Hombre,Normal,Tela,Hoka,Goma,Textil,Toda temporada,Vietnam,Textil,Tenis Hoka para Hombre Running Clifton 9,, 72783170,,,799.990,Running,
Tenis moda,Hombre,Normal,Sintético,Puma,Caucho,Textil,Toda temporada,Vietnam,Textil,Tenis Puma para Hombre Trinity . Tenis de Moda Puma,5 , 72716234,,,559.990,,
Guayos,Unisex,Normal,Sintético,Diadora,Goma,Poliéster,Toda temporada,China,Poliéster,Guayos Diadora para Cancha Sintética Futsof Unisex,, 883001500,,,149.990,,
,Hombre,Normal,Cuero,,Goma,Textil,,,,Tenis Hombre Nike Revolution 6 - Negro,4.3 , 126922266,,,369.950,Running,
Tenis deportivos,Hombre,Normal,Tela,Reebok,Caucho,Sintético,Primavera-Verano,China,,Tenis Reebok Hombre Running Lite 3.0,5 , 38217923,,,239.990,Running,
,Hombre,Normal,Cuero,,Caucho,Textil,,,,Zapatos Adidas Stan Smith WHT- Hombre,, 126774421,,,480.000,Training,
Tenis moda,Mujer,Normal,Sintético,Mossimo,Goma,Sintético,Toda temporada,China,,Tenis moda Mossimo Fanduzip Mujer,4.9 , 882662441,,,179.990,,
Tenis moda,Mujer,Normal,Sintético,Guess,Goma,Poliéster,Toda temporada,China,,Tenis moda Guess Braydin Mujer,5 , 63893108,461.99,538.99,769.990,,
Tenis moda,Niña,Normal,Tela,Skechers,Goma,,Toda temporada,Indonesia,Poliéster,Tenis Skechers Skech Airairmatic Sl para Niña,, 72794609,,,214.900,,Poliéster
,Hombre,Normal,Sintético,,Goma,Sintético,,,,Guayo Lotto Beluna Rb-H8 Cancha Cesped Natural Sintética,, 125940257,,,189.900,Fútbol,
Zapatos casuales,Niño,Normal,Textil,,Sintético (PU),Textil,,,,Tenis Zanial Gris para Niño Los Gomosos,, 127062504,,,119.900,,
Tenis moda,Niño,Normal,Cuero,Reebok,Goma,Textil,Toda temporada,China,Textil,Tenis Reebok Classic para Niño,, 72793527,139.89,159.89,199.900,,
Tenis moda,Mujer,Grande,Tela,Converse,Caucho,,Toda temporada,Vietnam,Poliéster,Tenis Converse para Mujer Moda Chuck Taylor All Star Lift,5 , 71195889,,,424.990,,Poliéster
Tenis deportivos,Hombre,Normal,Tela,Adidas,Caucho,Textil,Toda temporada,China,Textil,Tenis Adidas para Hombre Running Ultraboost Light 23,4.8 , 72767652,,,999.950,Running,
Tenis moda,Niño,Normal,Cuero,Reebok,Goma,Textil,Toda temporada,China,Textil,Tenis Reebok Classic para Niño,, 72793543,139.89,159.89,199.900,,
Tenis moda,Niño,Normal,Sintético,Skechers,Goma,Poliéster,Toda temporada,China,Poliéster,Tenis moda Skechers Bounder Rozerg para Niño,, 72882966,,,179.990,,
,Mujer,,Textil,,,,,,,Tenis Mujer Adidas Grand Court Td - Rosa-Blanco,, 127070650,272.909,299.9,332.900,,
Tenis deportivos,Hombre,Normal,Cuero,Under Armour,Goma,Textil,Toda temporada,Vietnam,Textil,Tenis Under Armour para Hombre Running Charged Verssert 2,, 72890625,,,389.990,Running,
Tenis moda,Mujer,Normal,Sintético,Skechers,Sintético,,Toda temporada,China,,Tenis Moda Skechers Gowalk Joy Mujer,, 31644484,,,259.900,,Poliéster
Tenis deportivos,Mujer,Normal,Sintético,Reebok,Caucho,,Toda temporada,Indonesia,,Tenis Reebok Mujer Running Energen Lite,4.9 , 63866848,,,209.990,Running,Textil
Tenis moda,Mujer,Normal,Cuero,Asics,Caucho,Poliéster,Toda temporada,Vietnam,Poliéster,Tenis Asics para Mujer Moda Gel-Nyc,, 72833637,,,549.990,,
,Mujer,Normal,Textil,,Caucho,Textil,,,,Tenis Nike Mujer Bajo Revolution 6 Nn,, 124480972,,,593.000,Running,
,Hombre,Normal,Textil,,Caucho,Malla (nylon),,,,Nike Lebron Witness Viii Tenis negro de hombre para baloncesto,, 128864900,,,559.950,Básquetbol,
Tenis moda,Mujer,Normal,Tela,Nike,Sintético,,Toda temporada,Vietnam,Poliéster,Tenis Nike para Mujer Moda Nike Tanjun Nn,, 72783999,,,364.950,,Poliéster
,Hombre,Normal,Textil,,Caucho,Malla (nylon),,,,UA Lockdown 6 Tenis negro de hombre para baloncesto,, 125380073,,,399.950,Básquetbol,
Tenis moda,Mujer,Normal,Cuero,Veja,Caucho,Poliéster,Toda temporada,Brasil,Textil,Tenis Veja para Mujer Moda Esplar Logo,, 72884161,,,839.990,Lifestyle,
,Hombre,,Textil,,Goma,,,,,Tenis Nike Fly.By Mid 3-Negro,, 126047315,,,359.990,Básquetbol,
Tenis moda,Hombre,Normal,Tela,Converse,Caucho,Textil,Toda temporada,Vietnam,Poliéster,Tenis Converse Ctas Cx Explore | Tenis de moda Converse,5 , 72763237,,,524.990,,
Tenis deportivos,Hombre,Normal,Sintético,Mountain Gear,Sintético,Sintético,Toda temporada,China,,Tenis Mountain Gear Hombre Outdoor Bontyn2,4.3 , 882678896,,,179.990,Outdoor,
Tenis moda,Unisex,Normal,Tela,Vans,Goma,Textil,Toda temporada,China,Textil,Tenis Vans Unisex Moda Old Skool,5 , 72813593,,,389.990,,
Tenis,Mujer,Normal,Tela,Puma,Caucho,Textil,Toda temporada,Vietnam,Textil,Tenis Puma para Mujer Running Feline Profoam Femme Wns,, 72716584,,,579.990,Running,
Tenis moda,Hombre,Normal,Cuero,New Balance,Caucho,Textil,Toda temporada,Indonesia,Textil,Tenis New Balance para Hombre Moda 574,5 , 72802397,,,525.990,,
Tenis moda,Niño,,Sintético,Puma,Sintético,,Toda temporada,China,,Tenis moda Puma All-day Active Ac Ps Niño,5 , 64398807,195.89,223.89,279.900,,Textil
Tenis deportivos,Mujer,Normal,Tela,Asics,Caucho,,Toda temporada,Indonesia,Poliéster,Tenis Asics para Mujer Running Gel-Kayano 29,, 72800804,,,749.990,Running,Poliéster
Tenis moda,Hombre,Normal,Cuero,Adidas Originals,Goma,Sintético,Toda temporada,China,,Tenis adidas Originals Hombre Moda Superstar,4.8 , 4321065,359.99,419.99,599.950,,
Tenis deportivos,Mujer,,Tela,Adidas,Caucho,,Toda temporada,Indonesia,,Tenis Adidas para Mujer Running EQ21 Run,4.8 , 23024137,299.99,349.99,499.990,Running,Textil
Tenis moda,Niño,Normal,Sintético,Asics,Caucho,Poliéster,Toda temporada,Camboya,Poliéster,Tenis Asics Gel Resolution 9 para Niño | Zapatillas Asics Gel Resolution 9 para Niño,5 , 72835912,,,369.990,,
Tenis moda,Mujer,Normal,Sintético,Skechers,Goma,Poliéster,Toda temporada,China,Poliéster,Tenis Skechers para Mujer Moda Slip Ins Ultra Flex 3.0,, 72778443,233.89,272.89,389.900,,
Tenis deportivos,Mujer,Normal,Tela,Under Armour,Caucho,Textil,Toda temporada,Indonesia,,Tenis Under Armour Mujer Running Surge 3,4.9 , 42790553,216.89,247.89,309.900,Running,
Tenis,Mujer,Normal,Sintético,Reebok,Goma,Textil,Toda temporada,Vietnam,Textil,Tenis Reebok para Mujer Cross Training Nanoflex Tr 2 | Tenis para Mujer de Cross Training Color Azul,4 , 72804665,272.99,311.99,389.990,Cross training,
Tenis,Hombre,Normal,Tela,Nike,Goma,Poliéster,Toda temporada,Indonesia,Poliéster,Tenis Nike para Hombre Running Revolution7,, 72875577,,,344.990,Running,
Tenis moda,Mujer,Normal,Sintético,Skechers,Goma,Poliéster,Toda temporada,China,Poliéster,Tenis Skechers para Mujer Moda Go Walk Air 2.0 Clas,, 72778360,227.89,265.89,379.900,,
Tenis deportivos,Mujer,Normal,Sintético,Nike,Goma,,Toda temporada,Vietnam,Poliéster,Tenis Nike para Mujer Running Revolution 6 Nn,5 , 72784006,251.99,287.99,359.950,Running,Poliéster
Tenis moda,Mujer,Normal,Cuero,Nike,Goma,,Toda temporada,Indonesia,Poliéster,Tenis Nike para Mujer Moda Blazer LoPlatform,5 , 72783810,384.99,439.99,549.990,,Poliéster
Tenis deportivos,Mujer,Normal,Tela,Reebok,Goma,Sintético,Toda temporada,Vietnam,Sintético,Tenis Reebok Mujer Running Energen Run 3,5 , 72713886,223.89,255.89,319.900,Running,
Tenis moda,Mujer,Normal,Sintético,Skechers,Caucho,,Toda temporada,Vietnam,Poliéster,Tenis Skechers para Mujer Moda Gorunsupersonic,4 , 72791525,221.99,258.99,369.990,,Poliéster
Tenis moda,Mujer,Normal,Sintético,Skechers,Goma,Poliéster,Toda temporada,Vietnam,Poliéster,Tenis Skechers Mujer - Zapatos Skechers Dama. Tenis blancos cómodos Skechers para mujer. Zapatillas moda D'Luxfitness,4.9 , 70961994,215.89,251.89,359.900,,
Tenis moda,Mujer,Normal,Sintético,Diadora,Sintético,Sintético,Toda temporada,China,,Tenis Diadora Mujer Moda Sildan2,4 , 882814798,149.99,174.99,249.990,Lifestyle,
Tenis moda,Mujer,Normal,Tela,Adidas,Caucho,Textil,Toda temporada,Indonesia,,Tenis Adidas para Mujer Moda Lite Racer 3.0,4.8 , 25623763,,,329.990,Lifestyle,
Tenis,Hombre,Normal,Tela,Fratta,Sintético,Malla (nylon),Toda temporada,China,Malla (Nylon),Tenis Fratta para Hombre Running Rollinarew,4.3 , 883014557,77.99,90.99,129.990,Running,
Tenis moda,Mujer,Normal,Sintético,Skechers,Goma,Poliéster,Toda temporada,Vietnam,Poliéster,Tenis Skechers para Mujer Moda Ultraflex 3 Lets Dnc,5 , 72820794,191.99,199.99,319.990,,
Tenis deportivos,Mujer,Normal,Sintético,Skechers,Caucho,Sintético,Toda temporada,China,,Tenis Skechers Mujer - Zapatos Skechers Dama. Tenis rosados cómodos Skechers para mujer. Zapatillas moda Cross training Go Run Elevate Quick Stride,4.9 , 61896433,191.99,223.99,319.990,Cross training,
Tenis moda,Mujer,Normal,Cuero,Nike,Caucho,Poliéster,Toda temporada,China,Poliéster,Tenis Nike para Mujer Moda Nike Blazer Low '77 Jumbo | Zapatillas Nike para Mujer Blazer Low 77,, 72833000,384.99,439.99,549.990,,
Tenis moda,Mujer,Normal,Cuero,Nike,Caucho,Poliéster,Toda temporada,China,Poliéster,Tenis Nike para Mujer Moda Nike Blazer Low '77 | Zapatillas Nike para Mujer Blazer Low 77,, 72832989,339.49,387.99,484.950,,
Tenis moda,Mujer,Normal,Sintético,New Balance,Caucho,Textil,Toda temporada,Vietnam,Textil,Tenis moda New Balance 500 Mujer,4.4 , 66428890,209.99,239.99,299.990,Lifestyle,
Tenis moda,Mujer,Normal,Cuero,New Balance,Caucho,Textil,Toda temporada,China,Textil,Tenis New Balance para Mujer Moda 550,, 72802544,,,769.990,,
Tenis moda,Mujer,Normal,Sintético,Skechers,Goma,Poliéster,Toda temporada,China,Poliéster,Tenis Skechers para Mujer Moda Go Walk Air 2.0,5 , 72778345,227.89,265.89,379.900,,
Tenis moda,Mujer,Normal,Sintético,Adidas,Caucho,Sintético,Toda temporada,Vietnam,Sintético,Tenis Adidas para Mujer Moda Court Platform,4.7 , 72889168,,,359.990,Lifestyle,
Tenis deportivos,Hombre,Normal,Tela,Nike,Caucho,Sintético,Toda temporada,Indonesia,Sintético,Tenis Nike Hombre Cross Training Legend Essential 3 Nn,4.6 , 56488706,,,489.990,Cross training,
Tenis moda,Hombre,Normal,Cuero,Adidas,Caucho,Textil,Toda temporada,Vietnam,Textil,Tenis Adidas para Hombre Moda VL Court 3.0,4.8 , 72888871,,,329.990,Lifestyle,
Tenis moda,Mujer,Normal,Tela,Adidas,Caucho,Textil,Toda temporada,Indonesia,Textil,Tenis Adidas Mujer Moda Alphaedge +,4.3 , 72712557,265.99,303.99,379.990,Lifestyle,
Tenis moda,Mujer,Normal,Cuero,Reebok,Goma,Sintético,Toda temporada,Vietnam,Sintético,Tenis Reebok Mujer Moda Club C 85,4.8 , 72714000,244.89,279.89,349.900,Lifestyle,
Tenis,Hombre,Normal,Tela,Under Armour,Sintético,Textil,Toda temporada,Indonesia,Textil,Tenis Under Armour Mujer Running Charged Pursuit 3,4.7 , 42790421,251.89,287.89,359.900,Running,
Tenis moda,Mujer,Normal,Sintético,Skechers,Goma,Poliéster,Toda temporada,Vietnam,Poliéster,Tenis Skechers para Mujer Moda Ultra Flex 3 Cls Ch,4.7 , 72820757,191.99,199.99,319.990,,
Tenis deportivos,Hombre,Normal,Sintético,Fratta,Sintético,Sintético,Toda temporada,China,,Tenis Fratta Hombre Running Zoenty,4.6 , 882678778,77.99,90.99,129.990,Running,
Tenis moda,Mujer,Normal,Sintético,Skechers,Goma,Poliéster,Toda temporada,Vietnam,Poliéster,Tenis Skechers para Mujer Moda Ultra Flex 3 Cls Ch,5 , 72820771,191.99,199.99,319.990,,
Tenis moda,Mujer,Normal,Sintético,Skechers,Goma,,Toda temporada,Vietnam,Poliéster,Tenis Skechers para Mujer Moda Glide Stepswift Slig,5 , 72791650,233.99,272.99,389.990,,Poliéster
Tenis moda,Hombre,Normal,Cuero,Adidas,Caucho,Textil,Toda temporada,Vietnam,Textil,Tenis Adidas para Hombre Moda VL Court 3.0,4.8 , 72888850,,,279.990,Lifestyle,
Tenis deportivos,Mujer,Normal,Tela,Reebok,Goma,Sintético,Toda temporada,Vietnam,Sintético,Tenis Reebok Mujer Running Floatride Energy 5,5 , 72714028,349.89,399.89,499.900,Running,
Tenis moda,Mujer,Normal,Sintético,Skechers,Goma,,Toda temporada,Vietnam,Poliéster,Tenis Skechers para Mujer Moda Glide Stepswift Slig,4.8 , 72791641,233.99,272.99,389.990,,Poliéster
Tenis moda,Mujer,Normal,Sintético,Diadora,Sintético,Sintético,Toda temporada,China,,Tenis Diadora Mujer Moda Sildan2,5 , 882814727,149.99,174.99,249.990,Lifestyle,
Tenis deportivos,Mujer,Normal,Tela,New Balance,Caucho,,Toda temporada,Vietnam,,Tenis New Balance Mujer Running M1,4.5 , 62387933,368.19,420.79,525.990,Running,
Tenis moda,Mujer,Normal,Cuero,New Balance,Caucho,Textil,Toda temporada,China,,Tenis New Balance Mujer Moda 574,4.8 , 64218048,390.59,446.39,557.990,,
Tenis moda,Hombre,Normal,Sintético,Nike,Goma,Sintético,Toda temporada,Indonesia,Sintético,Tenis Nike Hombre Moda Air Max SC,4.7 , 18841130,,,469.950,Lifestyle,
Tenis,Mujer,Normal,Tela,Fratta,Goma,Poliéster,Toda temporada,China,Poliéster,Tenis Fratta para Mujer Running Sabi2,4.4 , 883014804,89.99,104.99,149.990,Running,
Tenis moda,Mujer,Normal,Cuero,Reebok,Goma,Sintético,Toda temporada,Vietnam,Sintético,Tenis Reebok Mujer Moda Club C 85,4.9 , 72714007,244.89,279.89,349.900,Lifestyle,
Tenis moda,Mujer,Normal,Sintético,Skechers,Goma,,Toda temporada,Vietnam,Poliéster,Tenis Skechers para Mujer Moda Dluxfitness Brightba,, 72791570,221.99,258.99,369.990,,Poliéster
Tenis,Unisex,Normal,Tela,Adidas,Caucho,Textil,Toda temporada,Indonesia,Textil,Tenis Adidas Unisex Running Response Runner,4.8 , 72864306,,,199.990,Running,
Tenis moda,Hombre,Normal,Sintético,Skechers,Sintético,Poliéster,Toda temporada,China,Poliéster,Tenis Moda Skechers Summits Hombre,4.8 , 39304056,,,254.990,,
Tenis moda,Mujer,Normal,Cuero,Skechers,Goma,,Toda temporada,Vietnam,Poliéster,Tenis Skechers para Mujer Moda Dluxfitness Modestfl,4.8 , 72791587,215.99,251.99,359.990,,Poliéster
Tenis deportivos,Mujer,Normal,Tela,Adidas,Caucho,Textil,Toda temporada,Indonesia,Textil,Tenis Adidas para Mujer Running Duramo Speed,, 72777226,405.99,463.99,579.990,Running,
Tenis deportivos,Hombre,Normal,Tela,Diadora,Goma,,Toda temporada,Vietnam,Sintético,Tenis Diadora para Hombre Running Snipec | Zapatillas para hombre Diadora,4.8 , 882861332,131.99,153.99,219.990,Running,Sintético
Tenis moda,Mujer,Normal,Sintético,Skechers,Goma,,Toda temporada,Vietnam,Poliéster,Tenis Skechers para Mujer Moda Dluxfitness Brightba,4.8 , 72791563,221.99,258.99,369.990,,Poliéster
Tenis deportivos,Hombre,Normal,Sintético,Fratta,Sintético,Sintético,Toda temporada,China,,Tenis Fratta Hombre Running Vexel2,4.8 , 882758792,77.99,90.99,129.990,Running,
Tenis moda,Hombre,Normal,Cuero,Diadora,Caucho,Malla (nylon),Toda temporada,China,Malla (Nylon),Tenis Diadora para Hombre Moda Bamtelo,5 , 883015932,,,229.990,Lifestyle,
Tenis moda,Mujer,Normal,Sintético,Skechers,Goma,Poliéster,Toda temporada,China,Poliéster,Tenis Skechers para Mujer Moda Flexcomfort Freshene,5 , 72836663,,,299.990,,
Tenis,Mujer,Normal,Tela,Adidas,Caucho,Textil,Toda temporada,Indonesia,Textil,Tenis Adidas para Mujer Running Duramo,4.7 , 72864275,,,299.990,Running,
Tenis moda,Hombre,Normal,Sintético,Diadora,Caucho,Malla (nylon),Toda temporada,China,Malla (Nylon),Tenis Diadora para Hombre Moda James7,5 , 883015900,,,159.990,Lifestyle,
Tenis moda,Mujer,Normal,Sintético,Skechers,Goma,Poliéster,Toda temporada,China,Poliéster,Tenis Skechers para Mujer Moda Summits,4.9 , 72807851,179.99,199.99,254.900,,
Tenis deportivos,Hombre,Normal,Sintético,Fratta,Sintético,,Toda temporada,China,,Tenis Fratta Hombre Running Vexel2,4.6 , 882758873,77.99,90.99,129.990,Running,Sintético
Tenis,Mujer,Normal,Tela,Under Armour,Sintético,Textil,Toda temporada,Vietnam,Textil,Tenis Under Armour para Mujer Running Phade RN 2 | Zapatillas Under Armour Phade RN 2,4.5 , 72763428,188.99,215.99,269.990,Running,
Tenis moda,Mujer,Normal,Sintético,Skechers,Goma,,Toda temporada,Vietnam,Poliéster,Tenis Skechers para Mujer Moda Dluxfitness Brightba,5 , 72791554,221.99,258.99,369.990,,Poliéster
Tenis moda,Mujer,Normal,Sintético,Skechers,Goma,Poliéster,Toda temporada,China,Poliéster,Tenis Skechers para Mujer Moda Summits Free Classics,, 72890302,179.99,199.99,279.900,Lifestyle,
Tenis moda,Hombre,Normal,Tela,Adidas,Caucho,Textil,Toda temporada,Indonesia,Textil,Tenis Adidas Hombre Moda Alphaedge +,5 , 72712583,,,419.950,Lifestyle,
Tenis moda,Mujer,,Sintético,Diadora,Sintético,,Toda temporada,China,,Tenis Diadora Mujer Moda Sildan,4.8 , 882763707,143.99,167.99,239.990,,Sintético
Tenis,Mujer,Normal,Sintético,Fratta,Goma,Poliéster,Toda temporada,China,Poliéster,Tenis Fratta para Mujer Running Sternum,4.7 , 883014798,89.99,104.99,149.990,Running,
Tenis deportivos,Mujer,Normal,Sintético,Reebok,Goma,Sintético,Toda temporada,China,Textil,Tenis Deportivos Reebok para Mujer de Running Zig Dynamica,4.9 , 72790795,272.99,311.99,389.990,Running,
Tenis moda,Niño,Normal,Sintético,Nike,Sintético,Textil,Toda temporada,Indonesia,Textil,Tenis Nike Air Max Sc Bpv Niño Velcro,4.7 , 54793540,279.99,319.99,399.950,Lifestyle,
Tenis moda,Mujer,Normal,Cuero,Adidas,Caucho,Textil,Toda temporada,Vietnam,Textil,Tenis Adidas para Mujer Moda VL Court 3.0,4.8 , 72888897,,,329.990,Lifestyle,
Tenis deportivos,Mujer,Normal,Tela,Nike,Caucho,Textil,Toda temporada,Vietnam,Textil,Tenis Nike para Mujer Running Downshifter 12,4.7 , 60558652,,,399.950,Running,
Tenis moda,Mujer,Normal,Sintético,Skechers,Goma,Poliéster,Toda temporada,Vietnam,Poliéster,Tenis Skechers para Mujer Moda Skech Litepro Lightr,4.8 , 72806316,,,279.990,,
Tenis moda,Mujer,Normal,Sintético,Skechers,Goma,,Toda temporada,Vietnam,,Tenis moda Skechers Skech-Airdynamight Mujer,4.9 , 72837136,,,269.990,,Poliéster
Tenis moda,Mujer,Normal,Cuero,Skechers,Goma,,Toda temporada,Vietnam,Poliéster,Tenis Skechers para Mujer Moda Dluxfitness Modestfl,5 , 72791580,215.99,251.99,359.990,,Poliéster
Tenis deportivos,Hombre,Normal,Tela,Adidas,Caucho,Textil,Toda temporada,Indonesia,Textil,Tenis Adidas para Hombre Running Tenis Duramo Rc,4.7 , 72094059,,,299.990,Running,
Tenis moda,Hombre,Normal,Sintético,Bearcliff,Caucho,Malla (nylon),Toda temporada,China,Malla (Nylon),Tenis Bearcliff para Hombre Moda Acreta,4.5 , 883028998,,,139.990,Lifestyle,
Tenis,Hombre,Normal,Tela,Fratta,Sintético,Malla (nylon),Toda temporada,China,Malla (Nylon),Tenis Fratta para Hombre Running Soroll,5 , 883014528,77.99,90.99,129.990,Running,
Tenis moda,Hombre,Normal,Sintético,Skechers,Goma,Poliéster,Toda temporada,Vietnam,Poliéster,Tenis Skechers Hombre Moda Go Walk Glide,5 , 71008395,227.99,265.99,379.990,,
Tenis,Hombre,Normal,Tela,Adidas,Caucho,,Toda temporada,Indonesia,Textil,Tenis Adidas para Hombre Running Duramo Speed | Tenis de Running Color Negro,4.8 , 72801627,,,539.950,Running,Textil
Tenis,Mujer,Normal,Tela,Fratta,Goma,Poliéster,Toda temporada,China,Poliéster,Tenis Fratta para Mujer Running Sabi2,4.9 , 882814814,89.99,104.99,149.990,Running,
Tenis moda,Mujer,Normal,Sintético,Asics,Caucho,Poliéster,Toda temporada,Camboya,Poliéster,Tenis Asics Mujer Moda Japan S,4.8 , 69745050,251.99,287.99,359.990,,
Tenis,Hombre,Normal,Sintético,Puma,Caucho,,Toda temporada,China,Textil,Tenis Puma para Hombre Lifestyle Up,5 , 72794163,,,329.900,Lifestyle,Textil
Tenis moda,Hombre,Normal,Sintético,Skechers,Goma,Poliéster,Toda temporada,Vietnam,Poliéster,Tenis Skechers para Hombre Moda Aircushioning Binson,5 , 72728668,179.99,209.99,299.990,,
Tenis deportivos,Hombre,Normal,Tela,Nike,Caucho,Poliéster,Toda temporada,Vietnam,Poliéster,Tenis Nike para Hombre Running Revolution 7 | Zapatillas Nike Revolution 7,, 72832942,,,344.950,Running,
Tenis,Hombre,Normal,Tela,Fratta,Sintético,Malla (nylon),Toda temporada,China,Malla (Nylon),Tenis Fratta para Hombre Running Rollinarew,, 882816245,77.99,90.99,129.990,Running,
Tenis moda,Hombre,Normal,Sintético,Diadora,Goma,Malla (nylon),Toda temporada,China,Malla (Nylon),Tenis Diadora para Hombre Moda Nextgen,3.3 , 883016000,,,179.990,Lifestyle,
Tenis moda,Mujer,Normal,Sintético,Disney,Goma,Poliéster,Toda temporada,China,Poliéster,Tenis Disney para Mujer Moda Becourtmin2,4.6 , 883029575,,,129.990,Lifestyle,
Tenis moda,Mujer,Normal,Cuero,Nike,Goma,Sintético,Toda temporada,Vietnam,Sintético,Tenis Nike Mujer Moda Air Max System,4.8 , 70530288,377.99,431.99,539.950,,
Tenis moda,Mujer,Normal,Tela,Skechers,Goma,Poliéster,Toda temporada,Vietnam,Poliéster,Tenis Skechers para Mujer Moda Flex Appeal 4.0 Brilliantvie,5 , 72738992,167.99,195.99,279.990,,
Tenis deportivos,Mujer,Normal,Tela,Nike,Caucho,Poliéster,Toda temporada,Vietnam,Poliéster,Tenis Nike para Mujer Downshifter 12,, 72890741,,,318.990,Lifestyle,
Tenis moda,Mujer,Normal,Sintético,Skechers,Caucho,Poliéster,Toda temporada,China,Poliéster,Tenis Skechers para Mujer Dlites Arch Fit-Bett Tenis de Moda Skechers,4.9 , 72775081,233.99,272.99,389.990,,
Tenis deportivos,Mujer,Normal,Tela,Adidas,Caucho,Textil,Toda temporada,Indonesia,Textil,Tenis Adidas para Mujer Running Tenis Duramo Rc,4.7 , 72094095,,,299.990,Running,
Tenis moda,Mujer,Normal,Cuero,Diadora,Caucho,Malla (nylon),Toda temporada,China,Malla (Nylon),Tenis Diadora para Mujer Moda Bamtela2,5 , 883016836,,,249.990,Lifestyle,
Tenis deportivos,Hombre,Normal,Tela,Diadora,Goma,,Toda temporada,Vietnam,Sintético,Tenis Diadora para Hombre Running Snipec | Zapatillas para hombre Diadora,4.7 , 882861233,131.99,153.99,219.990,Running,Sintético
Tenis moda,Hombre,Normal,Cuero,Nike,Sintético,Poliéster,Toda temporada,Indonesia,Poliéster,Tenis Nike para Hombre Moda Air Max Sc,4.8 , 72875595,,,404.990,Lifestyle,
Tenis deportivos,Mujer,Normal,Tela,Reebok,Goma,Sintético,Toda temporada,Vietnam,Sintético,Tenis Reebok Mujer Running Energen Run 3,4.7 , 72714021,,,319.900,Running,
Tenis moda,Mujer,Normal,Sintético,Diadora,Caucho,Textil,Toda temporada,China,Textil,Tenis Diadora para Mujer Moda Court7,4.1 , 883017076,,,149.990,Lifestyle,
Tenis moda,Mujer,Normal,Sintético,Adidas,Caucho,Sintético,Toda temporada,Vietnam,,Tenis Adidas para Mujer Moda Court Platform,4.7 , 38212516,,,399.990,Lifestyle,
Tenis,Mujer,Normal,Tela,Nike,Goma,Poliéster,Toda temporada,Indonesia,Poliéster,Tenis Nike para Mujer Cross Training Legend Essential3,, 72875586,,,344.990,Cross training,
Tenis moda,Mujer,,Sintético,Skechers,Sintético,,Toda temporada,China,,Tenis Skechers Mujer Moda Summits Cool Classic,5 , 23121286,,,279.900,,Poliéster
Tenis deportivos,Mujer,Normal,Tela,Adidas,Caucho,Textil,Toda temporada,Vietnam,Textil,Tenis Adidas Mujer Cross training Everyset Trainer W,5 , 72712521,,,549.990,Cross training,
